name,phone,address,website,rating,user_ratings_total
BizimYaka Gayrimenkul,(0216) 484 12 52,"Safa, Sancaktar Cd. No:6, 34791 Sancaktepe/İstanbul, Türkiye",,4.8,12
Atabey İnşaat & Gayrimenkul,0530 123 92 28,"Mevlana, Veysel Karani Cd. No:251/a, 34791 Sancaktepe/İstanbul, Türkiye",http://instagram.com/atabeyinsaatgayrimenkul,5,26
REMAX MASAL,0532 215 15 14,"Atatürk, Acar Sk. No:1/A, 34785 Sancaktepe/İstanbul, Türkiye",https://www.remax.com.tr/masal,4.9,44
TURYAP SANCAKTEPE AYDOS TEMSİLCİLİĞİ,(0216) 642 04 04,"No:24, Akpınar, Kanuni Cd., 34885 Sancaktepe/İstanbul, Türkiye",,3.6,5
Bacik Emlak & İnşaat,(0216) 561 59 06,"Abdurrahmangazi, Ulus Cd., 34887 Sancaktepe/İstanbul, Türkiye",https://bacikemlak.sahibinden.com/,4.2,43
R&M GLOBAL GAYRİMENKUL YATIRIM DANIŞMANLIĞI,(0216) 423 23 45,"Abdurrahmangazi, Begüm Sk. No:16/A, 34887 Sancaktepe/İstanbul, Türkiye",,5,12
Remax AHMET ŞİMŞEK Sancaktepe Gayrimenkul Danışmanı,0542 286 59 60,"Sur Yapı Levander Ticari Bloklar, Eyüp Sultan, Deha Cd No:2, 34885 Sancaktepe/İstanbul, Türkiye",http://www.ahmetsimsek.org.tr/,5,3
DURSUNOĞLU İNŞAAT GAYRİMENKÜL SAN TİC LTD ŞTİ,0850 227 5714,"Yenidoğan mahallesi bahçeli evler cad 46-52 kat 2 no 1 ak, Yenidoğan, 34791 Sancaktepe/İstanbul, Türkiye",http://www.dursunogluinsaat.com.tr/,5,11
Remax Emrah Şentürk,0546 799 11 72,"Akpınar, Kanuni Cd. No:10, 34000 Sancaktepe/İstanbul, Türkiye",https://www.emrahsenturk.net/,5,45
Ortaklar Gayrimenkul,,"Sarıgazi, Lise Cd., 34785 Sancaktepe/İstanbul, Türkiye",,4.5,8
Taşanlar Emlak,(0216) 311 47 27,"Osmangazi, alsancak caddesi, Osmangazi, Bademli Sk. 25/a, 34887 Sancaktepe/İstanbul, Türkiye",,5,10
RE/MAX AKARAT,(0216) 498 44 77,"Akpınar, Kanuni Cd. NO:8/A, 34000 Sancaktepe/İstanbul, Türkiye",https://www.remax.com.tr/ofis/detay/akarat,4.4,32
Sancaktepe Satılık Daire,0530 500 71 58,"Abdurrahmangazi, 34887 Sancaktepe/İstanbul, Türkiye",,5,3
İMP GAYRİMENKUL,(0216) 622 36 36,"no:54 Sancaktepe/İstanbul, Veysel Karani, Kanuni Cd., 34885 Sancaktepe/İstanbul, Türkiye",,4.2,20
HİSAR EMLAK & TURİZM,0541 541 88 61,"Osmangazi, Polat Cd. 41/a, 34000 Sancaktepe/İstanbul, Türkiye",,4,48
Remax Prof,(0216) 471 18 77,"Sarıgazi, Atatürk Cd. Tepe Plaza 62-72 Kat 2 D 9, 34785 Sancaktepe/İstanbul, Türkiye",http://www.remax.com.tr/prof,4.7,31
Ateş Emlak & Gayrimenkul,(0216) 622 50 58,"İnönü Mah, Sarıgazi, İnönü Cd. 34/A, 34785 Sancaktepe/İstanbul, Türkiye",,4.3,11
Sancaktepe Emlak,0532 267 79 45,"Kemal Türkler, Demokrasi Cd. No:6, 34785 Sancaktepe/İstanbul, Türkiye",,,
Kayra Yapı Gayrimenkul,0539 251 47 07,"Atatürk, Sultangazi Cd. No:114A, 34785 Sancaktepe/İstanbul, Türkiye",,5,1
Nurs Emlek Hizmetleri,(0216) 621 15 32,"Sarıgazi 170 D, A, Kemal Türkler, Atatürk Cd. No:1, 34785 Sancaktepe/İstanbul, Türkiye",http://nursemlakhizmetleri.com/iletisim,3.3,14
Türyap Inşaat & Gayrimenkul,,"Atatürk, Atatürk Cd. No:197, 34785 Sancaktepe/İstanbul, Türkiye",,5,1
Esen Emlak,0506 204 35 49,"41, Yunus Emre, Veysel Karani Cd., 34791 Sancaktepe/İstanbul, Türkiye",,4.3,13
ANT Gayrimenkul,(0216) 621 16 60,"Kemal Türkler, Ziverbey Sk. No:1 No:2 Daire: 1, 00034 Sancaktepe/İstanbul, Türkiye",,4.4,7
YEŞİLYURT EMLAK GAYRİMENKUL DANIŞMANLIK,0535 367 31 73,"Yenidoğan, Merve, Zerdali Sk. no 13.7, 34000 Sancaktepe/İstanbul, Türkiye",,5,3
Dore Life,444 5 051,"Emek, Ordu Cd. No:8, 34785 Sancaktepe/İstanbul, Türkiye",http://www.emlakistasyonu.com.tr/,4.1,247
Sultanlar Karat İstanbul,,"İnönü, Sultangazi Cd., 34785 Sancaktepe/İstanbul, Türkiye",http://www.karatistanbul.org/,4.1,99
SATIROĞLU EMLAK&AUTO,0538 486 11 36,"Yunus Emre, Barbaros Blv. No:38, 34791 Sancaktepe/İstanbul, Türkiye",,4.6,9
DURSUNOĞLU İNŞAAT GAYRİMENKÜL,(0216) 430 92 49,"Yenidoğan, Gülistan Cd. No:9, 34791 Sancaktepe/İstanbul, Türkiye",,3.7,11
Kösem Emlak Ofisi,0534 834 75 87,"Safa, Veysel Karani Cd. 3/2, 34971 Sancaktepe/İstanbul, Türkiye",,5,2
Gürsoy GYO,(0216) 484 57 87,"Safa, Bahçelievler Cd. NO 13/1, 34791 Sancaktepe/İstanbul, Türkiye",http://www.gursoygyo.com/iletisim.html,5,3
Baz Yapı Gayrimenkul,(0216) 463 61 61,"Abdurrahmangazi mahallesi Ebubekir caddesi, Abdurrahmangazi, Albayrak Sk. No9/A, 34885 Sancaktepe/İstanbul, Türkiye",,3.3,4
1B3K EMLAK,(0216) 509 11 94,"Yunusemre mahallesi Veysel karani caddesi güneş sokak no.14/A Yenidoğan, Sancaktepe İstanbul, Yunus Emre, 34791 Sancaktepe/İstanbul, Türkiye",,5,1
Yenidogan Satılık Daire,0530 500 71 58,"Safa, Bahçelievler Cd. No:59, 34791 Sancaktepe/İstanbul, Türkiye",http://www.remax.com.tr/,5,1
Denge Emlak & İnşaat,,"İnönü, Taç Sk, 34785 Sancaktepe/İstanbul, Türkiye",https://dengeemlak.sahibinden.com/,2.4,7
ADRES 34 GAYRİMENKUL & ÇEKMEKÖY EMLAK OFİSİ,0532 494 81 11,"Mehmet Akif Ersoy Mahallesi, Davet Sk. NO:23/A, 34782 Çekmeköy/İstanbul, Türkiye",http://www.adres34gayrimenkul.net/,5,101
Turna Emlak İnşaat San. Tic. Ltd. Şti.,0541 604 10 04,"Merkez, Oğuzhan Cd. No35a, 34782 Çekmeköy/İstanbul, Türkiye",http://www.turnaemlak.net/,4.8,70
Çekmeköy Gayrimenkul Danışmanı,0554 185 34 10,"Çavuşbaşı Caddesi Bayrak Plaza, Mimar Sinan, No:1 K:2, 34782 Çekmeköy/İstanbul, Türkiye",https://www.remax.com.tr/danisman/20352/gurhun-leylekoglu,5,28
Görkan Emlak Gayrimenkul,0532 377 11 19,"Merkez, Kuşcu Sk No:13 Kat:1 D:2, 34782 Çekmeköy/İstanbul, Türkiye",https://asyaipinsaat.sahibinden.com/?userId=aM_NkkS--PUOUtJtqP0grXQ,5,143
BULBİEMLAK GAYRİMENKUL A.Ş,444 9 214,"Mimar Sinan, Mimar Sinan Cd. no:8 D:1A, 34782 Çekmeköy/İstanbul, Türkiye",http://www.bulbiemlak.com/,5,49
Aydaş Emlak,0532 160 86 36,"Kirazlıdere, Kışla Cd., 34788 10AÇekmeköy/İstanbul, Türkiye",http://www.aydasgayrimenkul.com/,5,363
Çekmeköy Gayrimenkul Uzmanı,0532 650 01 74,"ÇAVUŞBAŞI CADDESİ BAYRAK PLAZA, Mimar Sinan, NO:10 K:1, 34782 Çekmeköy/İstanbul, Türkiye",https://www.remax.com.tr/gayrimenkul-danisman-girisimci/1910/Alper-Bayarslan,5,15
ÇG ÇEKMEKÖY GAYRIMENKUL,0532 393 66 13,"Çamlık, Gaziler Cd. no:13, 34782 Çekmeköy/İstanbul, Türkiye",,4.8,42
H&M FİNANS GAYRİMENKUL,0532 152 91 28,"Mimar Sinan, Mimar Sinan Cd. No: 21/A, 34782 Çekmeköy/İstanbul, Türkiye",http://finansgayrimenkulcekmekoy.sahibinden.com/,4.9,85
Marka çekmeköy gayrimenkul,0532 384 23 86,"Çekmeköy Taşdelen, Cumhuriyet, Cumhuriyet Cd. No: 13, 34788 Çekmeköy/İstanbul, Türkiye",,4.7,27
Çekmeköy Karaman Emlak,0537 217 28 54,"Mehmet Akif, Meşrutiyet Sk. No:33/A, 34782 Çekmeköy/İstanbul, Türkiye",http://www.karamanemlakcekmekoy.com/,5,21
ROTA MERKEZ GAYRİMENKUL & ÇEKMEKÖY EMLAK OFİSİ,0542 103 52 53,"emlakcı çekmeköy, Merkez, Piri Reis Cd. no:28, 34782 Çekmeköy/İstanbul, Türkiye",https://ofisim.sahibinden.com/ilanlarim,4.7,30
ARTIBİR GAYRİMENKUL DANIŞMANLIK,(0216) 641 22 22,"Mimar Sinan, Bosna Cd. No:21 D:7, 34782 Çekmeköy/İstanbul, Türkiye",,5,16
ROOF Çekmeköy Emlak ve Gayrimenkul Danışmanlığı,0553 532 13 80,"Merkez, Erenler Cd 1/1 Kat 2 Daire 2, 34782 Çekmeköy/İstanbul, Türkiye",https://shbd.io/s/vZ7eZagi,4.9,17
dilli gayrimenkul,(0216) 641 59 60,"Merkez, Piri Reis Cd. No 20/B, 34782 Çekmeköy/İstanbul, Türkiye",,4.3,17
Çekmeköy Satılık Daire Emlakvar,(0216) 640 47 01,"Çamlık, Çamlık Sk. No:5 D:1, 34782 Çekmeköy/İstanbul, Türkiye",http://www.emlakvar.com.tr/,5,3
Emlak İstasyonu & Hukuk ve Avukatlık Hizmetleri & AHG Grup Şirketleri,0532 452 35 86,"Çekmeköy Mimar Sinan Mah.Çavuşbaşı cad 28 Kat 4 Daire 6/7, İş Merkezi, Mimar Sinan, 34776 Çekmeköy/İstanbul, Türkiye",http://www.emlakistasyonu.com.tr/,5,155
Cebrail Bilgili Gayrimenkul Çekmeköy,0534 689 47 87,"Madenler mah. Şht. Ünal Kalafat cd, Madenler, Madenler Sk. No:17, 34776 Ümraniye/İstanbul, Türkiye",,5,3
Kazaklar Emlak Gayrimenkul,0553 141 97 97,"Mimar Sinan, Mimar Sinan Cd. No:15/B, 34782 Çekmeköy/İstanbul, Türkiye",http://www.kazaklar.com.tr/,4,18
Çekmeköy Toprak İnşaat ve Gayrimenkul,(0216) 641 20 57,"Mimar Sinan, Mimar Sinan Cd. No:1 No:28, 34872 Çekmeköy/İstanbul, Türkiye",http://cekmekoytoprak.sahibinden.com/,5,1
Millionaire (milyoner) Gayrimenkul,0507 203 02 02,"Kirazlıdere, Cumhuriyet Cd. No : 6, 34788 Çekmeköy/İstanbul, Türkiye",,4.9,167
Wisrem Gayrimenkul Royal Şubesi---Çekmeköy,0532 369 97 76,"Güngören mah Turgut Özal caddesi, Güngören, Taşdelen Mevkii No:19/A, 34788 Çekmeköy/İstanbul, Türkiye",https://wisrem.com/,5,18
Doğa Evim Gayrimenkul,0501 327 58 86,"Sultançiftliği, Turgut Özal Cd. No:119/2, 34788 Çekmeköy/İstanbul, Türkiye",,5,10
REDSTONE City Gayrimenkul Emlak Çekmeköy,(0216) 232 31 30,"Merkez mah. Çavuşbaşı cad. No:42 kat:3 Daire:6-7, Merkez, 34406 Çekmeköy/İstanbul, Türkiye",https://www.instagram.com/redstonecitygayrimenkul/,5,1
Han Group Gayrimenkul Yatırım Danışmanlığı,(0216) 484 53 98,"Güngören mahallesi.Turgut özal bulvarı, Güngören, İzan Sk. No:14-A, 34788 Çekmeköy/İstanbul, Türkiye",,5,58
Hande Yerebakan Gayrimenkul,0532 156 32 86,"Mimar Sinan Mah. Çavuşbaşı Cad. Bayrak Plaza, Mimar Sinan, no:10 kat:1, 34741 Çekmeköy/İstanbul, Türkiye",,5,3
TURYAP ÇEKMEKÖY MİMAR SİNAN TEMSİLCİLİĞİ,0530 280 53 53,"Mimar Sinan, Mimar Sinan Cd. No:69 Daire:5, 34782 Çekmeköy/İstanbul, Türkiye",https://turyapcekmekoymimarsinan.sahibinden.com/,3.8,17
Çekmeköy Gayrimenkul Hizmetleri Osman ERDİM,0505 385 48 53,"Madenler Mahallesi Mürdüm Sokak Küçükoğlu İş Merkezi No :2 Kat :2, Madenler, 34776 ÜMRANİYE/Ümraniye/İstanbul, Türkiye",,5,1
ÇEKMEKÖY BEŞYILDIZ EMLAK,0532 312 80 78,"M,marsinan Mah.Çavuşbaşı Cad.Ceren Sok 4-C M,marsinan Mah.Çavuşbaşı Cad, Merkez, Ceren Sokağı No:4 D:C, 34782 Çekmeköy/İstanbul, Türkiye",https://cekmekoybesyildizemlak.sahibinden.com/,,
Tuna Emlak Çekmeköy,0532 201 74 89,"Mehmet Akif, Recep Ayan Cd. No: 13, 34774 Çekmeköy/İstanbul, Türkiye",https://tunaemlakcekmekoy.sahibinden.com/,5,2
Emek Emlak,(0216) 641 98 01,"Mehmet Akif, Kubilay Cd. No:34, 34782 Çekmeköy/İstanbul, Türkiye",,5,1
EDK İNŞAAT GAYRİMENKUL SAN. ve TİC.LTD.ŞTİ,(0216) 640 00 34,"Çamlık, Şahinbey Cd. No:52/5, 34010 Çekmeköy/İstanbul, Türkiye",,5,5
Nil Gayrimenkul,0539 780 06 10,"Cumhuriyet, Şht. Turan Cd. No:9-11/A, 34788 Çekmeköy/İstanbul, Türkiye",https://nilgayrimenkulcekmekoy.sahibinden.com/,4.1,9
BATUHAN EMLAK DANIŞMANLIK,0533 281 85 28,"Çamlık, Efes Sk. 29/B, 34788 Çekmeköy/İstanbul, Türkiye",,4.8,6
Alemdağ Merkez Emlak,(0216) 429 85 57,"Alemdağ, Saray Cd. No:203, 34776 Çekmeköy/İstanbul, Türkiye",http://www.alemdagmerkezemlak.com/,4.8,13
HAKAN GAYRİMENKUL & EMLAK DANIŞMANLIĞI,,"Mehmet Akif, Şahinbey Cd. No:31 F, 34782 Çekmeköy/İstanbul, Türkiye",,4.3,12
ERC Gayrimenkul & İnşaat,(0216) 642 51 01,"Mehmet Akif, Set Sk., 34782 Çekmeköy/İstanbul, Türkiye",,4.7,7
Alemdağ Emlak Konutları / CityLife Gayrimenkul,(0216) 640 56 62,"Alemdağ Emlak Konutları, Nişantepe, Turgut Özal Cd., 34794 Çekmeköy/İstanbul, Türkiye",http://citylife.com.tr/,4,19
YILMAZ EMLAK TAŞDELEN,0532 506 71 49,"Sultançiftliği, Turgut Özal Cd. No:119/B, 34788 Çekmeköy/İstanbul, Türkiye",http://yilmazemlaktasdelen.sahibinden.com/,4.9,26
Eshworld Gayrimenkul,0545 779 79 17,"Merkez, Erenler Cd No:1 D:1A, 34360 Çekmeköy/İstanbul, Türkiye",,5,5
Mesut Teymur Gayrimenkul Danışmanlık,0532 470 96 97,"Mimar Sinan, Çavuşbaşı Cd. No 10/1, 34782 Çekmeköy/İstanbul, Türkiye",,5,7
Re/Max Eksen,(0216) 642 02 22,"Bayrak Plaza, Mimar Sinan, Çavuşbaşı Cd. no:10 k:1, 34782 Çekmeköy/İstanbul, Türkiye",https://www.remax.com.tr/ofis/detay/eksen,4.2,68
Başari Emlak inşaat Gayrimenkul,0532 495 27 05,"Kirazlıdere, Mareşal Fevzi Çakmak Cd. No:1, 34788 Çekmeköy/İstanbul, Türkiye",,4.2,18
MUAZ ALTUN,0532 657 08 96,"Alemdağ, Saray Cd. No :203, 34794 Çekmeköy/İstanbul, Türkiye",http://www.muazaltun.com/,5,37
Ortak Gayrimenkul,(0216) 642 77 90,"25, Mehmet Akif, Senem Sk., 34780 Çekmeköy/İstanbul, Türkiye",,2.3,3
Pozitif GYO,(0216) 640 16 40,"Hamidiye, Hamidiye Cd. No 6, 34782 Çekmeköy/İstanbul, Türkiye",,3.5,11
Emlakçı'm Gayrimenkul,(0216) 365 31 21,"Madenler, Palandöken Cd. Yeni Şenocak Sitesi D:2 A Blok, 34776 Çekmeköy/Ümraniye/İstanbul, Türkiye",,4.7,3
Simge Gayrimenkul,(0216) 640 41 61,"Mimar Sinan, Saatçi Sk. No:6, 34782 Çekmeköy/İstanbul, Türkiye",,4,8
Çelik Gayrimenkul,(0216) 641 81 15,"74 Asya TR 34782, Çamlık, Şahinbey Cd. No:74, 34782 Çekmeköy/İstanbul, Türkiye",https://celikgayrimenkul.sahibinden.com/,4,4
Keller Williams Çekmeköy Harun TİLLİ Gayrimenkul Danışmanlığı,0545 516 66 01,"Cumhuriyet Mah. Vatan Cad, Cumhuriyet, Bengi Sk. No:1/A, 34788 Çekmeköy/İstanbul, Türkiye",https://haruntilli.kw.com/tr/,5,4
Çekmeköy Emlak,,"Mimar Sinan, Kaya Sk. no.4 D:3, 34782 Çekmeköy/İstanbul, Türkiye",,,
Sami Yazıcı Remax Eksen,0533 682 88 89,"Mimar Sinan, Çavuşbaşı Cd. bayrak plaza no : 10 / 1, 34782 Çekmeköy/İstanbul, Türkiye",https://www.remax.com.tr/danisman/4537/sami-yazici,4.9,21
Elite Life Grup Çekmeköy,0536 781 59 49,"Merkez, Köroğlu Cd. No:44 B D:3, 34794 Çekmeköy/İstanbul, Türkiye",,5,3
Alper Bayarslan,0532 650 01 74,"Mimar Sinan mh Cavusbasi caddesi Bayrak Plaza No:10 1Cekmekoy, Mimar Sinan, 34782 Çekmeköy/İstanbul, Türkiye",http://www.remax.com.tr/alperbayarslan,5,27
KW Çekmeköy - Keller Williams Çekmeköy Bölge Müdürlüğü,(0216) 641 41 84,"Cumhuriyet Mahallesi, Vatan Caddesi, Bengi Sokak No:1/A K:2 Taşdelen Çekmeköy, İstanbul - Türkiye, Cumhuriyet, 34788 Çekmeköy/İstanbul, Türkiye",,4.3,26
TURYAP Çekmeköy Kemerdere Temsilciliği,(0216) 364 88 88,"Necip Fazıl, Alemdağ Cad., Sarıkaya Sok. No:2 D:1, 34773 Ümraniye/İstanbul, Türkiye",http://www.turyap.com.tr/cekmekoykemerdere,3.9,12
TEMPO Time Gayrimenkul Danışmanlık,0532 291 79 72,"Mimar Sinan, Yavuz Selim Cd. No:3, 34782 Çekmeköy/İstanbul, Türkiye",,,
HZL EMLAK,0537 430 31 87,"Çamlık, Gaziler Cd. 11/A, 34782 Çekmeköy/İstanbul, Türkiye",https://www.instagram.com/hzl.emlak/,5,1
COLDWELL BANKER ERKAY GAYRİMENKUL,(0216) 641 94 94,"Alemdağ Cad. Çamlık Mevkii Karadağlı Plaza kat 3, Meclis, 34782 Çekmeköy/İstanbul, Türkiye",,5,4
Pendik Emlak,0533 471 30 10,"Efe Apart, Bahçelievler, Aydınlı Yolu Cd Eryetiş Sitesi Bina no.27 D.5, 34890 Pendik/İstanbul, Türkiye",,4.3,40
PENDİK GAYRİMENKUL ®,0534 400 21 21,"Velibaba, Yakacık Cd. no:8/1, 34890 Pendik/İstanbul, Türkiye",https://pendikgayrimenkul.sahibinden.com/,4.9,98
Dönüşüm Gayrimenkul,(0216) 307 10 10,"Velibaba, Barbaros Hayrettin Paşa Cd. 113/1, 34896 Pendik/İstanbul, Türkiye",https://donusumgayrimenkul.com.tr/,4.5,108
Prores Gayrimenkul Danışmanlığı ( Prores Emlak) Pendik Şubesi,0530 238 36 60,"Silkroad Residence Sitesi, Kurtköy, Sütçü İmam Cd no:11/1 E Blok, 34912 Pendik/İstanbul, Türkiye",https://prores.com.tr/,4.9,135
HATUN GAYRİMENKUL,0543 315 60 46,"Çamçeşme, Selamet Cd. 19 B, 34899 Pendik/İstanbul, Türkiye",https://hatungayrimenkul.sahibinden.com/,4.8,26
YİĞİT İSTANBUL GAYRİMENKUL YATIRIM DANIŞMANLIK MERKEZİ,0542 657 77 57,"Çamçeşme, Aydınlı Yolu Cd No:53, 34899 Pendik/İstanbul, Türkiye",https://www.facebook.com/yigitistanbulgyd?mibextid=LQQJ4d,5,153
Görgün gayrimenkul,0546 586 76 89,"Kaynarca, Kafkas Sk. No:19, 34890 Pendik/İstanbul, Türkiye",,4.8,18
Kurtköy Emlakçısı,0533 249 48 33,"Çağdaş Center, Yenişehir, Osmanlı Blv. No:10 B Blok Dükkan 67, 34912 Pendik/İstanbul, Türkiye",https://www.kurtkoyemlakcisi.com/,4.9,461
ADA Gayrimenkul Pendik,0531 868 44 44,"Yeşilbağlar, Turgut Paşa Cd. no:36/A, 34000 Pendik/İstanbul, Türkiye",https://adagrupgayrimenkul.sahibinden.com/,4.8,21
Konsepts Emlak,0532 711 87 31,"Kurtköy, Adalet Sk. No:43/B, 34890 Pendik/İstanbul, Türkiye",,4.9,146
Eser Emlak,0542 405 66 63,"Doğu, Doğu Mahallesi Ortanca Caddesi Ozan İş Hanı D:No: 49/23 Kat 2, Doğu, 34890 Pendik/İstanbul, Türkiye",,5,15
Pendik Gayrimenkul Danışmanı | Mustafa Nayir,0539 733 14 40,"Yeni, Begonya Sk. No:16 D:1E, 34893 Pendik/İstanbul, Türkiye",,5,32
Okçular Emlak - Gayrimenkul - Danışmanlık,(0216) 491 41 37,"Kaynarca, Çıkmaz Sk. No:4 D:F, 34890 Pendik/İstanbul, Türkiye",,4.5,25
Kaçmaz Emlak Pendik,(0216) 596 26 01,"Fevzi Çakmak, Tevfik İleri Cd No 66 Kat: 2, 34500 Pendik/İstanbul, Türkiye",http://www.kacmazemlak.com/pendik-fevzicakmak,3.6,5
Canan Gayrimenkul Pendik,(0216) 390 24 41,"Yeni, Plevne Cd. No:5 D:B, 34893 Pendik/İstanbul, Türkiye",https://canangayrimenkul.sahibinden.com/,4.3,10
TEKNOPARK EMLAK KURTKÖY YENİŞEHİR EMLAKÇI,0532 163 91 12,"Yenişehir, Osmanlı Blv. Çağdaş Center İş merkezi no 10 Dükkan 99, 34890 Pendik/İstanbul, Türkiye",,5,31
PENDİK GAYRİMENKUL 2,0505 594 53 34,"Esenler, Rifat Ilgaz Cd no:124b, 34890 Pendik/İstanbul, Türkiye",https://www.pendikgayrimenkul.com/,5,5
Bölge Emlak,(0216) 390 20 23,"Kaynarca, Aydınlı Yolu Cd No:179 D:A, 34890 Pendik/İstanbul, Türkiye",,5,14
Arda Gayrimenkul,,"Esenler, Yuva Sk. No:2, 34899 Pendik/İstanbul, Türkiye",,4.7,29
Zemlak Gayrimenkul,0551 955 13 34,"Yeni, Süreyyapaşa Cd No:86, 34893 Pendik/İstanbul, Türkiye",,5,3
Nehir Emlak Gayrimenkul Ve Danışmanlık,0539 477 39 78,"Alt, Kaynarca, Karadeniz Cd. No:11/A, 34890 Pendik/İstanbul, Türkiye",,5,6
Asırlı Yapı ve İnşaat Gayrimenkul ve Emlak Danışmanlığı,0532 517 33 24,"Doğu, Hatboyu Cd. No:88/B, 34890 Pendik/İstanbul, Türkiye",,5,7
Seri Gayrimenkul,(0216) 307 61 00,"OPTIMUM LOFT, Kurtköy, Ankara Cd. No:400 Kat:6 Daire:30, 34890 Pendik/İstanbul, Türkiye",https://serigayrimenkul.sahibinden.com/,3.9,20
Minik Emlak & Gayrimenkul,(0216) 354 88 00,"Yeni, Zafer Cd. no : 64 / 3, 34893 Pendik/İstanbul, Türkiye",http://www.minikemlak.com/,4.6,17
Yeni Çağ Gayrimenkul,0552 730 13 45,"Bahçelievler, Mostar Blv. No:21, 34893 Pendik/İstanbul, Türkiye",https://yenicaggayrimenkull.sahibinden.com/,4.4,11
TURYAP Pendik İsmet Erdoğmuş,0544 242 79 02,"Kaynarca, Aydınlı Yolu Cd No: 137/B, 34000 Pendik/İstanbul, Türkiye",https://coldwellbankeramiral.sahibinden.com/?userId=ambRt_omXzkE9acMWD7soeQ,4.7,13
ALTIN EMLAK PENDİK KURTKÖY TEMSİLCİLİĞİ,0532 732 70 85,"KURTKÖY MAH. ANKARA CAD, Kurtköy, Selvi Boylum Sk NO:1/8, 34912 Pendik/İstanbul, Türkiye",http://www.altinemlak.com.tr/pendikkurtkoy,4.7,16
Erkan Emlak,0532 202 40 61,"Doğu mh. Lokman Hekim Cd. Gölde Sk. Selvi Apt, Doğu, D:16/2, 34890 Pendik/İstanbul, Türkiye",,4.8,4
Remax pendik,0506 100 12 78,"Yeni, Süreyyapaşa Cd, 34890 Pendik/İstanbul, Türkiye",https://www.remax.com.tr/danisman/22729/huseyin-aydogmus,4.1,12
Düzener Emlak,(0216) 483 73 00,"Batı, Erol Kaya Cd No:107, 34890 Pendik/İstanbul, Türkiye",,4.8,9
Kraliçe Gayrimenkul,,"Sapan Bağları, Şht. Miralay Nazım Bey Cd No:12, 34893 Pendik/İstanbul, Türkiye",http://kralicegayrimenkul.com/,4.3,18
Necip Gayrimenkul,0532 133 39 11,"30 Yakacık Caddesi &, Velibaba, Ceviz Sk., 34896 Pendik/İstanbul, Türkiye",https://necipemlakpendik.sahibinden.com/,3.9,20
GÜZİDE EMLAK VE TEREKOGULLARI İNŞ,0532 657 15 81,"Kaynarca, Denız Caddesı No:66 D:B, 34890 Pendik/İstanbul, Türkiye",http://guzideemlak.com/,4,2
REER GAYRİMENKUL,0546 137 24 25,"Batı, Kaynarca, Hastane Cd. No:16 b blok dukkan c, 34890 Pendik/İstanbul, Türkiye",,5,5
Redwoork,0850 840 0733,"Fevzi Çakmak Mahallesi Tevfik İleri Caddesi Meşe Çıkmazı Sokak No:2 P216 İş Merkezi, Fevzi Çakmak, Ofis No: 23, 34890 Pendik/İstanbul, Türkiye",https://www.redwoork.com/,4.5,8
1453 Yapı İstanbul Esenyalı Emlak,0546 675 25 25,"Orhangazi Mahallesi, Anahtar Sokak No:10, Orhangazi, 34903 Pendik/İstanbul, Türkiye",,4.5,71
PROPARTNERS TÜRKİYE GAYRİMENKUL HİZMETLERİ,(0216) 511 24 11,"Kaynarca, Karadeniz Cd. No:55/A, 34890 Pendik/İstanbul, Türkiye",https://www.propartnersturkiye.com/,5,5
Remax Gold,(0216) 482 18 88,"Kurtköy, Harmandere, Reyhan Cd. No:54/16 D:5, 34912 Pendik/İstanbul, Türkiye",https://remaxgold.com.tr/,4.7,141
karınca emlak güzelyalı şubesi,(0216) 392 06 04,"No:7/B, Güzelyalı, İstiklal Cd., 34903 Pendik/İstanbul, Türkiye",http://www.karincaemlak.com/,4.3,16
TURYAP PENDİK MERİÇ OKÇU,0533 938 01 81,"Kaynarca, Aydınlı Yolu Cd Mavikule Rezidans 137/B, 34890 Pendik/İstanbul, Türkiye",,5,2
ELÇİ GAYRİMENKUL,0530 390 44 44,"Esenler, Muhsin Yazıcıoğlu Cd No : 31 / A, 34890 Pendik/İstanbul, Türkiye",,3.4,5
COŞKUN GAYRİMENKUL,0546 596 17 00,"Esenler mah Naim süleymanoğlu cad, Esenler, belediye arkası no 23 A, 34896 Pendik/İstanbul, Türkiye",,5,2
Utku Gayrimenkul Danışmanlık,(0216) 354 75 52,"Doğu, ece sokak no 9, 34890 Pendik/İstanbul, Türkiye",,5,1
Karınca Emlak,0535 216 41 37,"Batı, Piramit Sokağı No:2, 34890 Pendik/İstanbul, Türkiye",http://www.karincaemlak.com/,4.3,7
Emin Emlak ve Gayrimenkul,0535 068 29 99,"Esenler Mh. Kirazlı Mescit Sk, Çamçeşme, Polis Karakolu Karşı Sokağı No:6/A, 34899 Pendik/İstanbul, Türkiye",https://eminemlakvegayrimenkul.sahibinden.com/,5,2
Kuzen Gayrimenkul Danışmanlık,0545 393 21 00,"Kıymet Serin İşmerkezi, Batı, Vişne Sk. No:35, 34890 Pendik/İstanbul, Türkiye",https://kuzen.com.tr/,5,1
YD GAYRİMENKUL DANIŞMANLIK (Yapı Dünyası),0542 479 12 98,"Bahçelievler, Aydınlı Yolu Cd 18 E, 34873 Pendik/İstanbul, Türkiye",,5,4
YILMAZ EMLAK GAYRİMENKUL DANIŞMANLIĞI,(0216) 596 00 20,"Malazgirt Caddesi, Fevzi Çakmak, Anilar Sokağı No:1 No.1, 34899 Pendik/İstanbul, Türkiye",https://yilmazemlakgayrimenkul.sahibinden.com/,3.8,4
Point Gayrimenkul,(0216) 595 49 49,"Kurtköy, Ankara Cd. No:380/A, 34906 Pendik/İstanbul, Türkiye",http://www.pointgyd.com/,3.7,10
KAYA PLUS GAYRİMENKUL,,"Kurtköy, Başkale Sk, 34912 Pendik/İstanbul, Türkiye",https://kayaplusgayrimenkul.sahibinden.com/,3.9,16
Gözdağı Karınca Emlak,0535 215 65 66,"numara 18, Dumlupınar, Gözdağı Cd, 34896 Pendik/İstanbul, Türkiye",,4.9,7
TOKU GAYRİMENKUL KENTSEL DÖNÜŞÜM HİZMETLERİ,0532 300 03 65,"Batı, Vişne Sk. No:18/B, 34890 Pendik/İstanbul, Türkiye",,3.7,3
Merkez Inşaat & Emlak,0532 287 72 55,"Fevzi Çakmak, Erzincan Cd. 32/A, 34899 Pendik/İstanbul, Türkiye",http://www.merkezinsaatemlak.net/,5,2
Dolayoba Emlak,0507 251 14 42,"Dumlupınar, Ankara Cd. No:100, 34896 Dolayoba-Pendik/Pendik/İstanbul, Türkiye",https://www.sahibinden.com/satilik-daire/istanbul-pendik-dolayoba/emlak-ofisinden,4,1
Mertcan Emlak,(0216) 452 93 34,"Şeyhli, Nazar Sk No:24, 34906 Pendik/İstanbul, Türkiye",,4.1,30
Anadolu İnşaat ve Gayrimenkul,(0216) 597 02 08,"Esenler Mahallesi Mimar Sinan Cad. Cengiz Dilek Sok. No: 2/1 A Blok 2.kat D:26, Esenler, 34899 Pendik/İstanbul, Türkiye",http://www.anadolu-insaat.com.tr/,3.3,3
GÜVEN EMLAK,0532 546 03 69,"GÜVEN GAYRİMENKUL, Fevzi Çakmak, Girne Cd. No:5, 34899 Pendik/İstanbul, Türkiye",https://www.emlakjet.com/,4.7,9
Pendik Yavuz Emlak,,"Batı, 34890 Pendik/İstanbul, Türkiye",,3.8,11
Öz Ateş Emlak,0532 795 39 96,"Çınardere, 450 Konutlar Cd No:3 D:B, 34896 Pendik/İstanbul, Türkiye",,4.1,10
Ake İkon Gayrimenkul & Proje Danışmanlığı,0553 326 61 61,"Doğu, Aydınlı Yolu Cd NO:57, 34893 Pendik/İstanbul, Türkiye",https://akeikongayrimenkul.sahibinden.com/,4.3,4
Tuzla Emlakçı,0530 238 22 66,"İstasyon, İstasyon Cd. No:164, 34940 Tuzla/İstanbul, Türkiye",http://www.conceptdanismanlik.com/,3.1,12
COŞKUN İNŞAAT EMLAK,0534 380 24 90,"Battalgazi, Bosna Blv. No:152, 34935 Sultanbeyli/İstanbul, Türkiye",http://coskuninsaatemlak.com/,4.9,30
Censam Gayrimenkul,0538 055 48 26,"Battalgazi, Selçukhan Cd. No:228, 34934 Sultanbeyli/İstanbul, Türkiye",https://censamgroup.com/,4.9,64
Merss Gayrimenkul & Danışmanlık,0506 535 27 30,"Battalgazi, Tesbih Sk. No:26-30, 34935 Sultanbeyli/İstanbul, Türkiye",http://merssgayrimenkul.com/,5,20
LİVA GAYRİMENKUL,0544 285 00 13,"Adil, Said Nursi Cd. 10 A, 34000 Sultanbeyli/İstanbul, Türkiye",,4.7,39
Yeniveri Gayrimenkul,(0216) 419 26 96,"M.Akif Ersoy Mh, Kuran Kursu Cd. No:49/A, 34000 Sultanbeyli/İstanbul, Türkiye",https://www.yeniverigayrimenkul.com.tr/,5,17
Sultanbeyli Emlak Konutları,(0216) 640 56 62,"Mimar Sinan, Basra Cd., 34935 Sultanbeyli/İstanbul, Türkiye",,4,140
Tamkoç Emlak İnşaat,0536 590 46 63,"Mecidiye, Süngü Sk. No:2A 34930, 34930 Sultanbeyli/İstanbul, Türkiye",http://www.instagram.com/tamkocemlakinsaat,4.9,17
Egemen Emlak Gayrimenkul,0532 251 80 28,"İstanbul, Turgut Reis, Fatih Blv. no 223/c, 34930 Sultanbeyli/İstanbul, Türkiye",,5,12
Altunay Emlak,0533 697 21 89,"Mehmet Akif Mahallesi Faith Bulvarı &, Mehmet Akif, Gün Cd. No:11, 34920 Sultanbeyli/İstanbul, Türkiye",,5,4
Yağız inşaat gayrimenkul,0544 617 93 23,"Mimarsinan mahallesi spor yolu caddesi, Mimar Sinan, Ayvalı Sk. 6/8, 34000 Sultanbeyli/İstanbul, Türkiye",http://www.cemileyagiz.com/,4.9,29
Villalar Emlak,0536 410 39 01,"Necip Fazıl, Kuran Kursu Cd. no:383, 34925 Sultanbeyli/İstanbul, Türkiye",,5,3
KUTUROĞLU EMLAK,(0216) 398 44 14,"Abdurrahmangazi, Fatih Blv. No:79, 34920 Sultanbeyli/İstanbul, Türkiye",,4.3,3
İlbanlar Gayrimenkul,0530 866 95 13,"Necip Fazıl, Sait Havva Cd. No:7/9, 34925 Sultanbeyli/İstanbul, Türkiye",,5,5
REALTY BLUE TİCARİ GAYRİMENKUL DANIŞMANLIĞI,0536 529 12 61,"Abdurrahmangazi, Atatürk Cd. No:30/1, 34920 Sultanbeyli/İstanbul, Türkiye",http://realtyblue.com.tr/,5,41
Seymen Emlak,0532 452 02 21,"Necip Fazıl, Antalya Cd. no:156, 34000 Sultanbeyli/İstanbul, Türkiye",,4.9,10
Turkuaz Emlak,,"Adil, Arşın Sk., 34935 Sultanbeyli/İstanbul, Türkiye",https://myturkazgayrimenkul.sahibinden.com/,4.7,7
Babalar Gayrimenkul,0537 246 88 08,"Mimar Sinan, Mimar Sinan Cd. No:40, 34935 Sultanbeyli/İstanbul, Türkiye",,4.6,10
Ada Gayrimenkul,0532 176 66 07,"Adil, İbrik Sk, 34935 Sultanbeyli/İstanbul, Türkiye",https://adagayrimenkulsancaktepe.sahibinden.com/,5,3
