name,phone,address,website,rating,user_ratings_total
Senkron Gayrimenkul EMLAK OFiSi FENERYOLU KADIKÖY iSTANBUL,0533 385 49 91,"A, Feneryolu, Göktepe Sk. No:12, 34724 Kadıköy/İstanbul, Türkiye",https://senkrongayrimenkul.sahibinden.com/,5,199
Emlakçı Oytun Mertol Gayrimenkul Danışmanlığı,(0216) 345 40 04,"Osmanağa, Serasker Cd. no: 49/1, 34714 Kadıköy/İstanbul, Türkiye",,5,481
NESA EMLAK MODA,0533 314 47 99,"Geçit Apartmanı, Caferağa, Moda Cd. No:141 D:2, 34710 Kadıköy/İstanbul, Türkiye",http://www.nesaemlakmoda.com/,4.8,82
Size Özel Emlak,0532 508 14 11,"Kozyatağı, Sıtma Pınar Sk. No:9, 34742 Kadıköy/İstanbul, Türkiye",,5,142
Akar Emlak,,"Merdivenköy, Küme Sk. NO:33/A, 34732 Kadıköy/İstanbul, Türkiye",http://akaremlak.sahibinden.com/,4.9,133
RE/MAX Yıldız,(0216) 380 17 17,"19 Mayıs, İnönü Cd. No:92 K:2, 34736 Kadıköy/İstanbul, Türkiye",http://www.remax-yildiz.com/,4.4,115
Fidan Gayrimenkul Emlak,0507 452 81 09,"Doğan Bey Apt, Merdivenköy, Hamle Sk. No:4 D:B, 34732 Kadıköy/İstanbul, Türkiye",,4.5,119
Berat Oğur Emlak,0533 468 48 56,"Caferağa, Ressam Şeref Akdik Sokağı No : 36 / C, 34710 Kadıköy/İstanbul, Türkiye",http://beratogur.com.tr/,4.5,49
Mavi Emlak Bağdat Caddesi,0532 304 65 85,"Ethemefendi Cad, Erenköy, Fırın Sk. Turan Ap No:10/B, 34738 Kadıköy/İstanbul, Türkiye",http://www.maviemlak.org/,4.9,42
ACIBADEM EMLAK,0535 462 76 00,"Acibadem Dörtyol, Acıbadem, Sarayardı Cd. No: 9A, 34660 Kadıköy/İstanbul, Türkiye",https://www.sahibinden.com/ilan/emlak-konut-satilik-ozel-mimarisiyle-ilginizi-cekecek-tasarim-esyali-satilik-dublex-1226001496/detay,4.9,40
Yaşam Emlak,(0216) 337 04 77,"Feneryolu, Fahrettin Kerim Gökay Cd No:84, 34724 Kadıköy/İstanbul, Türkiye",,4.9,49
Sembol Emlak,(0216) 599 12 34,"Fener Kalamış Caddesi, Fenerbahçe, Bilgili Sk. Can Apt No:6/4, 34726 Kadıköy/İstanbul, Türkiye",http://www.sembolemlak.com/,5,22
ARTI GAYRİMENKUL KOZYATAĞI,(0216) 361 20 20,"19 Mayıs Mah, Kozyatağı, Bayar Cd. No:22/1, 34736 Kadıköy/İstanbul, Türkiye",https://gayrimenkularti.com/,4.9,40
Kadikoy Kiralık Daire Emlak Ofisi,0533 741 03 34,"Merdivenköy, 34732 Kadıköy/İstanbul, Türkiye",,5,15
Kadıköy Emlak,(0216) 450 39 94,"Rasimpaşa, İzzettin Sk. 70/A, 34716 Kadıköy/İstanbul, Türkiye",https://www.sahibinden.com/satilik-daire/istanbul-kadikoy/emlak-ofisinden,4.3,9
NETm² CADDE,0532 669 90 70,"Göztepe, Güvenç Sk. No:7, 34730 Kadıköy/İstanbul, Türkiye",http://www.necipaktas.com/,5,70
Odak Emlak Danışmanlık,0533 766 07 76,"Caferağa, Cem Sk. No:21/3, 34710 Kadıköy/İstanbul, Türkiye",http://www.odakemlak.com.tr/,4.6,48
Çiftçioğlu Gayrimenkul,0538 057 54 32,"Sahrayı Cedit, Şemsettin Günaltay Cd. No:230/5, 34000 Kadıköy/İstanbul, Türkiye",https://ciftcioglugayrimenkul.sahibinden.com/,5,22
Yapı 34 Gayrimenkul,,"Kozyatağı, Korkut Sk., 34742 Kadıköy/İstanbul, Türkiye",http://www.yapi34.net/,5,17
Ev-yap Emlak Kadıköy,(0216) 337 33 56,"Rasimpaşa, Meltem Sk. Sultan Apt. No:4 D:2, 34716 Kadıköy/Istanbul - Asia, Türkiye",https://kadikoyevyapemlak.sahibinden.com/,4.3,30
TURYAP KADIKÖY GÖZTEPE GAYRİMENKUL EMLAK,(0216) 565 56 00,"Göztepe Tütüncü Mehmet Efendi Caddesi &, Göztepe, Nadirağa Sk. Hayat Apt No:3 D:1, 34730 Kadıköy/İstanbul, Türkiye",http://www.turyap.com.tr/goztepe,4.7,32
Depar Gayrimenkul,(0216) 418 49 69,"Zühtüpaşa, Itri Dede Sokağı No:32/b, 34724 Kadıköy/İstanbul, Türkiye",,5,24
RE/MAX Cadde Gayrimenkul,(0216) 355 70 60,"Caddebostan mah. Bağdat Cad. Santral Ap. No:292 K:1, Caddebostan, D:2, 34728 Kadıköy/İstanbul, Türkiye",http://www.remaxcadde.com/,4.6,148
Re/Max Pusula Gayrimenkul Danışmanlık,(0216) 386 82 82,"Erenköy, Fırın Sk. No:33 D:7 K:3, 34738 Kadıköy/İstanbul, Türkiye",http://www.remax.com.tr/pusula,4.8,49
KvG GAYRİMENKUL YATIRIM,0544 290 16 17,"Caddebostan, Caddebostan İskele Sk. No:15, 34742 Kadıköy/İstanbul, Türkiye",https://kvggayrimenkul.com/,5,83
Tanzimat Emlak,0536 760 25 99,"Göztepe, Tanzimat Sk. No.43/3, 34730 Kadıköy/İstanbul, Türkiye",https://tanzimatemlak.sahibinden.com/,5,26
İzak Hason Emlak Danışmanlığı,(0216) 478 23 00,"Erenköy, Bağdat Cad. No:326 D:1, 34726 Kadıköy/İstanbul, Türkiye",,4.6,29
Korhan Gayrimenkul Şube,0532 372 69 09,"Caddebostan, Sarı Gül Sk. No:24/1/B, 34728 Kadıköy/İstanbul, Türkiye",http://www.korhangayrimenkul.com.tr/,5,1
Kaptan Emlak,(0216) 349 18 00,"Caferağa, Moda Cd. No:69 D:B, 34710 Kadıköy/İstanbul, Türkiye",http://www.kaptanemlak.com.tr/,3.3,118
ALAN GAYRİMENKUL,0532 290 92 53,"Bostancı, Prof. Dr. Kemal Akgüder Cd. No:24/1, 34700 Kadıköy/İstanbul, Türkiye",http://www.alangayrimenkul.sahibinden.com.tr/,5,7
İbrahim Demir Gayrimenkul,0532 063 58 16,"Sahrayıcedit Mah. Batman Sok. Royal Plaza No:18 K: 13, Sahrayıcedit, Sahrayı Cedit, 34734 Kadıköy/İstanbul, Türkiye",https://www.ibrahimdemirgayrimenkul.com/,5,15
City Gayri̇menkul TÜRKİYE Alper Demirtaş,(0216) 566 31 20,"Ateş Er Apt, Feneryolu, Mustafa Mazhar Bey Sokağı No:41/A, 34724 Kadıköy/İstanbul, Türkiye",http://www.citygayrimenkul.com.tr/,4.6,29
Erdal Çolak Gayrimenkul,(0216) 386 16 95,"Göztepe, Ömer Paşa Sk. no:37/A, 34738 Kadıköy/İstanbul, Türkiye",https://erdalcolakgayrimenkul.sahibinden.com/,4.5,26
Emlakİste,(0216) 418 60 55,"Acıbadem, Acıbadem Cd. No:19, 34718 Kadıköy/İstanbul, Türkiye",,4.8,12
KADIKÖY NOKTA EMLAK,(0216) 449 42 72,"Rasimpaşa, Halitağa Cd. No:72/4, 34716 Kadıköy/İstanbul, Türkiye",,4.5,16
Class Gayrimenkul Danışmanlık,0532 224 27 15,"Halitağa Cad. Osmanağa Mah. Yıldırım Han No:17, Osmanağa, Vahap Bey Sk., 34714 Kadıköy/İstanbul, Türkiye",http://www.classemlak.com/,4.4,22
Remax,(0216) 572 46 46,"Sahrayıcedit Mah. Batman Sok. Royal Plaza No:18 K: 13, Sahrayıcedit/Kadıköy, Sahrayı Cedit, 34734 Kadıköy/İstanbul, Türkiye",https://www.remaxjoker.com/,4.6,56
Realty Box Ender Gayrimenkul Erenköy,(0216) 385 45 19,"Erenköy Mh., Hacı Hakkı Bey Sokak No:29 Aksu Apt. Daire:6, Erenköy, 34738 Kadıköy/İstanbul, Türkiye",https://realtyboxendergayrimenkulerenkoy.sahibinden.com/,5,149
Pera İstanbul Gayrimenkul & Yapı,(0216) 372 17 22,"Kozyatağı, Kocayol Cd. No:33/B, 34742 Kadıköy/İstanbul, Türkiye",,4.3,6
İstanbul Gayrimenkul,(0216) 380 10 60,"Kozyatağı, Hilmi Paşa Sk 37/C, 34742 Kadıköy/İstanbul, Türkiye",,5,1
İSTANBUL EMLAK OFİSİ,(0216) 346 72 69,"Feneryolu, Bağdat Cad. Köşk Apt. No:108 D:1, Fenerbahçe, 34726 Kadıköy/Istanbul - Asia, Türkiye",http://www.istanbulemlak.com.tr/,5,4
Berk Emlak,(0216) 349 24 93,"Rasimpaşa, Yavuztürk Sk. 20/2, 34716 Kadıköy/İstanbul, Türkiye",https://berkemlakkadikoy.sahibinden.com/,5,8
Dilge Emlak,0532 722 12 12,"Feneryolu, Bağdat Cad. No:146/4, 34724 Kadıköy/İstanbul, Türkiye",http://www.dilgeemlak.com/,4.7,25
Turyap Kadıköy,0544 193 38 38,"Fikirtepe, Mandıra Cd. 58a, 34720 Kadıköy/İstanbul, Türkiye",https://www.turyap.com.tr/,4.8,16
REMAX MUTLU,(0216) 359 08 08,"Göztepe, Bağdat Cad. NO:227/3, 34000 Kadıköy/İstanbul, Türkiye",http://www.remax.com.tr/mutlu,4.6,58
Taş Emlak Ofisi,(0216) 545 89 62,"Hasanpaşa, Taşocağı Sokağı 11/1, 34722 Kadıköy/İstanbul, Türkiye",,4.1,23
ASYALI EMLAK KADIKÖY,(0216) 345 94 35,"Eğitim Ünal Sokak No:E3, Eğitim, 34722 Kadıköy/İstanbul, Türkiye",http://www.asyaliemlak.com/,5,9
Merttürk Emlak,(0216) 416 01 46,"43/A Gaziethempasa Sok. No, Kozyatağı, Can Sk. No:24, 34742 Kadıköy/İstanbul, Türkiye",https://mertturkemlak.sahibinden.com/,5,5
TURYAP KADIKÖY FENERYOLU GAYRİMENKUL,0532 343 36 54,"Göztepe, Mustafa Mazhar Bey Sokağı Polvan Ap No: 28/2, 34724 Kadıköy/İstanbul, Türkiye",http://turyap.com.tr/feneryolu,5,12
EMR GAYRİMENKUL - Emir Ahmet Özbek,0530 360 00 07,"Göztepe, Mustafa Kaya Sokağı Yüzüncü Yıl Apt. No:7, 34744 Kadıköy/İstanbul, Türkiye",https://emrgayrimenkul34.sahibinden.com/,5,17
SNR PROJE EMLAKÇI SATIŞ OFİSİ,0532 321 71 88,"Göztepe, Nadirağa Sk. 50.YIL APT NO.10/G, 34730 Kadıköy/İstanbul, Türkiye",http://www.snrproje.net/,4.6,19
Kadıköy Emlak ve İç Mimarlık,0530 449 43 84,"Dumlupınar, Melih Cevdet Anday Sokağı No:4A, 34734 Kadıköy/İstanbul, Türkiye",,5,5
CADDE TIME GAYRİMENKUL,0533 665 51 51,"Göztepe Mah DR, ATAPOL APT, Göztepe, Prof. Mustafa Reşit Belgesay Sk. 23/B, 34730 Kadıköy/İstanbul, Türkiye",https://caddetime.sahibinden.com/,4.8,6
Beyaz Saray Emlak,(0216) 566 29 79,"Hızırbey Caddesi, Dumlupınar, Mektep Sk. 1/A, 34720 Kadıköy/İstanbul, Türkiye",https://beyazsarayemlak.sahibinden.com/,5,11
Coldwell Banker Mayor Gayrimenkul,(0216) 232 20 01,"Bostancı, Prof. Dr. Kemal Akgüder Cd. No:2/A, 34744 Kadıköy/İstanbul, Türkiye",http://www.cb.com.tr/mayor,4.9,23
Neta Emlak Hizmetleri,(0216) 418 46 06,"Caferağa, Gen. Asım Gündüz Cd. No:75, 34710 Kadıköy/İstanbul, Türkiye",,3.6,44
Bahariye Emlak,(0216) 338 92 72,"Caferağa, Serasker Cd. Aybek İş Hanı No:8 D:69, 34714 Kadıköy/İstanbul, Türkiye",,3.6,21
Kahraman Emlak,0533 212 22 00,"Caferağa, Dr. Esat Işık Cd. No:19, 34710 Kadıköy/İstanbul, Türkiye",https://kahramangayrimenkulmoda.sahibinden.com/,5,7
ERGÜN GAYRİMENKUL,0543 132 52 52,"Göztepe, Perçem Sk. No:19, 34730 Kadıköy/İstanbul, Türkiye",,5,5
Sunar emlak,0535 557 44 49,"Rasimpaşa, Recaizade Sk. No:83, 34716 Kadıköy/İstanbul, Türkiye",,4.9,7
Ataşehir Gayrimenkul,0507 963 19 03,"Atatürk Mahallesi, Sedef Caddesi Ata Blokları Ata 3/1 No: 58, Atatürk, 34758 Ataşehir/İstanbul, Türkiye",http://www.atasehirgayrimenkul.com/,4.9,34
Ataşehir Emlak Müşavirliği İstanbul TÜRKİYE,0555 579 10 81,"İçerenköy, Mutlu Sk. No:2 D:b, 34752 Ataşehir/İstanbul, Türkiye",https://www.atasehiremlak.com/,4.9,41
Ruşen Er Ticari Gayrimenkul Uzmanı: Bina Arsa Depo Fabrika Lüks Konut Ataşehir,0532 051 90 43,"Keller Williams Fores, Denge Panorama Kat:B2, Küçükbakkalköy, Küçük Setli Sok. No:5, 34636 Ataşehir/İstanbul, Türkiye",https://ermaxteam.sahibinden.com/,5,68
ASEDAS EMLAK ATAŞEHİR,,"Atatürk, Sedef Cd. No:3 Ata 2-1 Blok K1, D:161, 34758 Ataşehir/İstanbul, Türkiye",https://asedas.sahibinden.com/,4.5,85
RE/MAX CEM GAYRİMENKUL EMLAK ATAŞEHİR MALTEPE KÜÇÜKYALI,0532 335 93 02,"Küçükbakkalköy, Ozan Veysel Sokağı No: 11, Da: 1-2, 34750 Ataşehir/İstanbul, Türkiye",https://www.remax.com.tr/danisman/29605/cem-tarlabasi,5,39
Gözde Emlak,(0216) 572 44 54,"İçerenköy Mahallesi Karslı Ahmet Cad, İçerenköy, Aydın Sk. Ün Apt No:30 Dükkan:A, 34752 Ataşehir/İstanbul, Türkiye",http://www.gozdeemlak.com/,4.8,70
Remax Beta Ataşehir Emlak Ofisi,(0216) 455 11 88,"Ata Blokları, Atatürk, Ataşehir Blv. 3/2, 34750 Ataşehir/İstanbul, Türkiye",https://www.remax.com.tr/beta,4.9,126
Aren Emlak | Gayrimenkul,0541 469 30 35,"İçerenköy Mahallesi,Başıbüyük caddesi Seyhan Sk.N:2/a, İçerenköy, 34752 Ataşehir/İstanbul, Türkiye",http://www.arenemlak.com/,4.9,86
Ataşehir Real Estate,0545 527 58 58,"İnönü, Kayışdağı Cd. No: 272/A, 34755 Ataşehir/İstanbul, Türkiye",,4.8,74
Hayri Nişancı - Gayrimenkul Danışmanı - Remax City,0532 425 55 47,"Küçükbakkalköy mah. Ozan Veysel Sk. N:11 Kat:1, Küçükbakkalköy, D:2, 34750 Ataşehir/İstanbul, Türkiye",https://www.remax.com.tr/gayrimenkul-danisman-girisimci/e953/Hayri-Nisanci,5,64
Profesyonel Gayrimenkul City,0505 237 79 01,"Küçükbakkalköy, Hasanpaşa Sk. No:12, 34750 Ataşehir/İstanbul, Türkiye",https://www.gayrimenkul.city/,5,21
Nova Emlak & Gayrimenkul,0553 453 89 91,"İçerenköy, Akça Sk. no: 7/B, 34750 Ataşehir/İstanbul, Türkiye",,4.8,17
Metropolist Gayrimenkul,0536 494 26 91,"Atatürk Mahallesi, Metropol İstanbul A BLOK, KAT 18, Atatürk, No:299, 34750 Ataşehir/İstanbul, Türkiye",https://metropolistgayrimenkul.sahibinden.com/,4.9,39
RE/MAX CENTRIUM - ATAŞEHİR,(0216) 606 44 33,"İçerenköy, Merkez Cami Sk. No: 9, 34752 Ataşehir/İstanbul, Türkiye",https://remaxcentrium.com/,4.9,149
Ata Emlak,0532 644 30 40,"Atatürk, Ataşehir Blv. GARDENYA 3 SİTESİ 44 ADA D:5. BLOK, D:7, 34758 Ataşehir/İstanbul, Türkiye",http://www.ataemlak.com/,5,11
Özkan Gün Remax Gayrimenkul Danışmanı,0532 725 28 10,"Atatürk, Turgut Özal Blv. Gardenya 42/Ç Çarşısı No: 8/A Kat:1, 34758 Ataşehir/İstanbul, Türkiye",https://www.ozkangun.com/,5,16
Ataşehir Emlak,(0216) 455 00 40,"Atatürk, Ataşehir Blv. Gardenya 5 B Blok 63. Ada D:22 A D1, 34775 Ataşehir/İstanbul, Türkiye",,2.2,6
Ab Oryaş Gayrimenkul,(0216) 469 00 13,"İçerenköy Kayışdağı Caddesi, İçerenköy, Engin Sk. No:11 D:6, 34750 Ataşehir/İstanbul, Türkiye",,4.6,34
Remax City Küçükbakkalköy - Ataşehir,(0216) 310 54 54,"Küçükbakkalköy Mah. Ozan Veysel Sk N:11 Kat:1, Küçükbakkalköy, D:2, 34750 Ataşehir/İstanbul, Türkiye",https://www.instagram.com/remaxcityatasehir/,3.4,127
İce Gayrimenkul Ataşehir,(0216) 575 33 44,"İnönü, Kayışdağı Cd. No:150 D:3, 34755 Ataşehir/İstanbul, Türkiye",,5,2
Altınışık Gayrimenkul,(0216) 455 61 89,"Altinişik, Atatürk, Şengün Sk. No:3 Apt. D:53, 34758 Ataşehir/İstanbul, Türkiye",https://mehmetgfbmehmet.sahibinden.com/,4,1
REMAX Abc Batı Ataşehir Ofisi,(0216) 688 71 70,"Barbaros, Ihlamur Bv, 34746 Ataşehir/İstanbul, Türkiye",http://www.remaxabc.com/,4.9,61
PLATİN GAYRİMENKUL & İNŞAAT,(0216) 315 03 15,"Örnek, Fehmı Tokay Caddesı No:5 D:4, 34704 Ataşehir/İstanbul, Türkiye",,4.9,40
Expat Ataşehir Gayrimenkul ve Danışmanlık,(0216) 909 01 67,"Maritza Residence, Küçükbakkalköy, Dilek Sabancı Cd. No:34 Kat:1 Daire:8, 34750 Ataşehir/İstanbul, Türkiye",https://expatatasehir.sahibinden.com/,3.8,4
Emlak Store,0533 507 00 24,"Kayışdağı Mah. İnkılap Cad. No:17, Dudullu OSB, D:2, 34755 Ataşehir/İstanbul, Türkiye",,4.4,61
Onur Barni Gayrimenkul Ataşehir Dumankaya İkon,0507 200 12 00,"Örnek, Ercüment Batanay Sk. No 14 C a3 blok, 34704 Ataşehir/İstanbul, Türkiye",http://www.onurbarni.com/,5,109
başkan emlak ataşehir,(0216) 576 32 22,"İnönü, Kayışdağı Cd. no124, 34755 Ataşehir/İstanbul, Türkiye",,5,3
ÜMİT ŞENGÜR GAYRİMENKUL,0532 421 96 60,"İçerenköy, Rize Sk. No: 3/B, 34750 Ataşehir/İstanbul, Türkiye",http://www.umitsengurgayrimenkul.com/,5,22
Çevik Emlak içerenköy,0532 394 62 70,"İçerenköy, Oyacı Sk. No: 29, 34752 Ataşehir/İstanbul, Türkiye",http://www.cevikemlak.com.tr/,5,3
Remax Ataşehir Emlakçı BULUT BALCI,0501 155 19 89,"Atatürk, Turgut Özal Blv. Gardenya 42 Ç, No:8, 34758 Ataşehir/İstanbul, Türkiye",,5,2
KOÇKAN Gayrimenkul & Yatırım,0534 555 52 62,"Barbaros, Begonya Sk. No:7, 34746 Ataşehir/İstanbul, Türkiye",http://kockangayrimenkul.com/,5,10
ATAŞEHİR BURAK EMLAK,(0216) 574 60 52,"Küçükbakkalköy, Cengiz Topel Cd. no:12, 34750 Ataşehir/İstanbul, Türkiye",,4.8,4
Nova Gayrimenkul,(0216) 330 51 51,"Küçükbakkalköy Mahallesi, Dudullu Caddesi No:23-25 Brandium Residence D:R2 Blok D:1, Küçükbakkalköy, 34750 Ataşehir/İstanbul, Türkiye",http://www.novaturkiye.com/,4,27
Serkan Kaya Gayrimenkul Ataşehir,0532 771 61 69,"Denge Panorama, Küçükbakkalköy, Küçük Setli Sok. Kat: B2, 34750 Ataşehir/İstanbul, Türkiye",https://kwfores.sahibinden.com/?userId=aIf72UYGHhyXaROvL3puAhg%20serkankaya.kw.com,5,3
CELEPOĞLU İNŞAAT GAYRİMENKUL DANIŞMALIĞI,0530 038 90 89,"Atatürk, Sülün Cd. No:18 D:1B, 34758 Ataşehir/İstanbul, Türkiye",https://celepoglugayrimenkul.sahibinden.com/,5,1
yeditepe emlak,0536 226 17 10,"İnönü Mahallesi 19 Mayıs Caddesi, Dudullu OSB, Leylaklar Sk. No:25, 34755 Ataşehir/İstanbul, Türkiye",,4.3,24
Emlak Park Ataşehir,,"İnönü, Büyük Atatürk Cd. No:14, 34750 Ataşehir/İstanbul, Türkiye",,4.4,14
Yuvako - Akıllı Gayrimenkul Ofisi,,"İçerenköy Mahallesi, AND Plaza Topçu İbrahim Sokak 8-10 D, İçerenköy, 34752 Ataşehir/İstanbul, Türkiye",,4.8,17
Ataşehir Vizyon Gayrimenkul,(0216) 290 04 79,"Atatürk Bulvarı No: 2/B Metropol İstanbul C1 Blok K:16 D:260 Ataşehir Metropol, Atatürk, 34758 Ataşehir/İstanbul, Türkiye",https://atasehirvizyongayrimenkul.sahibinden.com/,3.7,6
AtaCity Emlak,(0216) 456 45 76,"Atatürk Mahallesi Ataşehir Bulvarı 38 Ada Ata Blokları Ata - 3 Plaza Kat 1 D-16, Atatürk, 34758 Ataşehir/İstanbul, Türkiye",http://www.atacityemlak.com.tr/,4.3,6
EmlakClub Ataşehir,(0216) 455 12 44,"Ataşehir Bulv. 38 Ada Ata3-4 No46 Ataşehir Bulv. 38, Küçükbakkalköy, Ada Ata3 No:4 No46, 34758 Ataşehir/İstanbul, Türkiye",,4.1,15
SAĞLAM GAYRİMENKUL,0533 684 08 98,"İçerenköy, Küçükbakkalköy Yolu Cd. Eryuva Sitesi, 34752 Ataşehir/İstanbul, Türkiye",,4.2,11
Savaş Emlak Gayrimenkul,0532 566 54 80,"Küçükbakkalköy, Tevfik Fikret Cd. No:16/B, 34750 Ataşehir/İstanbul, Türkiye",https://savasgayrimenkulatasehir.com/,5,3
REMAX Deha Gayrimenkul Danışmanlık,(0216) 455 60 65,"Atatürk, Turgut Özal Blv. Gardenya 42/Ç Çarşısı No: 8/A Kat:1, 34758 Ataşehir/İstanbul, Türkiye",https://www.remax.com.tr/ofis/detay/deha,4.2,31
Yenişehir Gayrimenkul Ataşehir,,"İnönü, Kayışdağı Cd. No:130 /3, 34755 Ataşehir/İstanbul, Türkiye",,5,2
Canan Işık İnşaat Emlak,0532 308 26 74,"Prof. Necmetin Erbakan Caddesi, İçerenköy, Yücel Sk. no:17/b, 34752 Ataşehir/İstanbul, Türkiye",,4.3,29
Altaş Emlak Arsa Ofisi,(0216) 573 52 42,"18/C Kader Apt. & Oyacı Sok İçerenköy Mah Ataşehir İstanbul Turkey 34752, İçerenköy, Karslı Ahmet Cd., 34752 Ataşehir/İstanbul, Türkiye",,4.4,7
"Century21 ATA Gayrimenkul, Ataşehir",0531 959 51 21,"Barbaros, Begonya Sk. alıve plaza D:7/11, 34746 Ataşehir/İstanbul, Türkiye",http://www.ataglobalgayrimenkul.com/,4.2,15
COLDWELL BANKER ARI GAYRİMENKUL ATAŞEHİR,0533 207 87 11,"Atatürk, Ataşehir Blv. No 8 D:33, 34758 Ataşehir/İstanbul, Türkiye",https://www.cb.com.tr/tr-TR/Offices/Detail/ari,4.5,8
Asia Emlak İçerenköy,0541 574 94 54,"İçerenköy, Seyhan Sk. 5/a, 34752 Ataşehir/İstanbul, Türkiye",https://asiaemlak.sahibinden.com/,3.7,22
Elite Life Gayrimenkul,0532 322 55 64,"İÇERENKÖY MAHALLESİ KARSLI AHMET CADDESİ, İçerenköy, Adem Sk. NO:45 /A, 34752 Ataşehir/İstanbul, Türkiye",,5,1
Merc Gayrimenkul Danışmanlık,(0216) 969 19 95,"Küçükbakkalköy, Başöğretmen Cd 34/A, 34750 Ataşehir/İstanbul, Türkiye",,5,4
Erdem KILIÇ - Lisanslı Gayrimenkul Danışmanı,0532 154 10 12,"Küçükbakkalköy, Ozan Veysel Sokağı N:11 Kat:1-2-3, 34758 Ataşehir/İstanbul, Türkiye",https://www.erdemkilic.com/,5,2
ATAŞEHİR TREND GAYRİMENKUL,0544 855 70 16,"Atatürk Mah. Fazıl paşa Sok. Trendist Ataşehir No: 9/11 D:108 Doğu Ataşehir, Atatürk, 34758 Ataşehir/İstanbul, Türkiye",,5,3
Çözüm'sell Emlak | Brandium Ataşehir,(0216) 504 08 90,"Brandium R2 Residence D:3 Dudullu Cad., Küçükbakkalköy, 34750 Ataşehir/İstanbul, Türkiye",,3.7,3
Ataşehir Loft Gayrimenkul,(0216) 456 22 77,"Atatürk Mahallesi Metropol İstanbul Sitesi C1 Blok Daire:242, Atatürk, 34758 Ataşehir/İstanbul, Türkiye",,,
Genç Gayrimenkul Kayışdağı,(0216) 313 37 19,"Kayışdağı, Akyazı Cd 22/A, 34755 Ataşehir/İstanbul, Türkiye",https://gencgayrimenkul.sahibinden.com/,4.8,5
TURYAP BATI ATAŞEHİR,(0216) 317 65 20,"BARBAROS MAH. MİMAR SİNAN CAD. NO:164 BATI, Barbaros, 34746 Ataşehir/İstanbul, Türkiye",http://www.turyap.com.tr/batiatasehir,3.9,15
Erencan Emlak,(0216) 575 00 51,"İçerenköy, Prof. Dr. Necmettin Erbakan Cad. & Küçük Çiftlik Sok. 5/A, 34752 Ataşehir/İstanbul, Türkiye",,5,4
Evax Gayrimenkul,0546 575 40 14,"İnönü, Narçiçeği Sk., 34755 Dudullu Organize Sanayi Bölgesi/Ataşehir/İstanbul, Türkiye",,4,37
Modi Emlak,0535 950 09 90,"Mimar Sinan Mahallesi hakimiyeti milliye caddesi Emlak kredi carsısı no 47 kat 1 dukkan 71, Mimar Sinan, 34672 Üsküdar/İstanbul, Türkiye",https://modiemlak.sahibinden.com/,4.9,119
Emin Emlak Ofisi,0532 414 26 60,"Zeynep Kamil, Dr. Fahri Atabey Cd. No:116 D:B, 34668 Üsküdar/İstanbul, Türkiye",,4.9,340
EN UYGUN EMLAK,(0216) 650 72 85,"Cumhuriyet, Özbirlik Sk. No:22/B, 34699 Üsküdar/İstanbul, Türkiye",http://enuygunemlak.org/,4.9,279
Anka Birleşik Emlakçılar Bulgurlu Temsilciliği,0541 521 42 71,"Bulgurlu, Söğütlü Çayır Cd. NO:5/A, 34696 Üsküdar/İstanbul, Türkiye",https://ankabirlesikemlakcilar.com/,4.9,256
Kuzey Emlak Ofisi,(0216) 310 54 44,"Valide-i Atik Mahallesi Miroğlu Sokak No:86/A, Valide-i Atik, 34664 Üsküdar/İstanbul, Türkiye",http://kuzeyemlakuskudar.sahibinden.com/,4.9,68
Pelen Emlak,0539 485 86 80,"İcadiye, Dündar Sk. No:2 D:B, 34674 Üsküdar/İstanbul, Türkiye",,5,43
Emlak Dünyası üsküdar,0532 783 33 19,"Selamiali mahallesi cumhuriyet caddesi damla apt no 44 dükkan 1, Selami Ali, 34660 Üsküdar/İstanbul, Türkiye",http://www.emlakdunyasiuskudar.com/,4.5,21
ENTA EMLAK,0533 247 26 71,"Ferah, Ferah Cd. No : 82 A, 34692 Üsküdar/İstanbul, Türkiye",https://www.entaemlak.com/,4.5,22
Emlak Danışmanı Mustafa KIR,0532 606 73 32,"Küçük Çamlıca, Libadiye Cd. No: 8E, 34696 Üsküdar/İstanbul, Türkiye",,5,164
Gayrimenkul 216,(0216) 343 02 16,"Valide-i Atik, Çavuşdere Cd. 74A, 34664 Üsküdar/İstanbul, Türkiye",,4.9,99
F-L EMLAK,0546 802 35 03,"Bulgurlu, Dere Sk. No:19, 34696 Üsküdar/İstanbul, Türkiye",http://flemlak.sahibinden.com/,4.8,94
Zirve Emlak,0546 497 36 60,"Bulgurlu, Ayçiçek Sk. No:2A, 34696 Üsküdar/İstanbul, Türkiye",https://zirveemlakbulgurlu.sahibinden.com/,5,125
Yeşil Emlak Üsküdar,0542 424 61 39,"İcadiye, Mağazacı Sokağı No:10, 34674 Üsküdar/İstanbul, Türkiye",http://www.yesilemlak.com/,4.9,15
Kaçmaz Emlak Acibadem,0530 527 36 16,"Acıbadem, Acıbadem Cd. No:173 D:G, 34660 Üsküdar/İstanbul, Türkiye",http://www.kacmazemlak.com/acibadem,4.9,178
Garanti Emlak Üsküdar,0544 800 99 53,"İcadiye, Yazmacı Sokağı 9a, 34674 Üsküdar/İstanbul, Türkiye",,5,13
REMAX Piramit,(0216) 327 30 35,"Acıbadem, Acıbadem Cd. No:218, 34660 Üsküdar/İstanbul, Türkiye",https://www.remaxpiramit.com/,4.4,238
Metropol İstanbul Emlak,(0216) 747 30 34,"Bulgurlu Mah. Bağcılar Cad. Detay 1 Sitesi, Bulgurlu, 34696 Üsküdar/İstanbul, Türkiye",http://metropolistanbulemlak.sahibinden.com/,5,29
Bulgurlu Gayrimenkul Emlak Danışmanlığı,0532 301 93 28,"Bulgurlu Mahallesi Bulgurlu Caddesi, Bulgurlu, Şura Sk. No:17/A, 34696 Üsküdar/İstanbul, Türkiye",https://bulgurluemlak.sahibinden.com/,4.8,56
Üsküdar Özyılmaz Gayrimenkul,(0216) 532 30 71,"Zeynep Kamil, Balcılar Yokuşu Sokağı 10/B, 34668 Üsküdar/İstanbul, Türkiye",,4.2,49
Üsküdar Gayrimenkul,0507 963 19 03,"Atatürk mh, Sedef Cd. Ata - 3 Plaza Ata 3/1, 34758 Ataşehir/İstanbul, Türkiye",,5,4
özkan emlak üsküdar,0542 213 91 26,"Murat Reis, Gazi Cd. 25A, 34664 Üsküdar/İstanbul, Türkiye",,5,1
Özkan Emlak,(0216) 343 94 87,"Murat Reis, Gazi Caddesi, Çinili Çocuk Şb. Yanı 111/C, 34664 Üsküdar/İstanbul, Türkiye",http://www.ozkanemlak.com/,4,6
MAXİMUM GAYRİMENKUL,0532 053 15 75,"mimar sinan mh. atlas çıkmazı üsküdar kapalı çarşı no:13/1 dükkan 264, Mimar Sinan, 34672 Üsküdar/İstanbul, Türkiye",http://www.maximumgayrimenkul.com.tr/,4.7,18
Keller Williams Boğaziçi Gayrimenkul Bölge Müdürlüğü,(0216) 709 46 86,"Altunizade Mh. Fahrettin Kerim Gökay Cd, Altunizade, Bestekar Saadettin Kaynak Sk No:3 B D:2, 34662 Üsküdar/İstanbul, Türkiye",http://kwbogazici.kw.com/,4.6,52
Yankı Grup Gayrimenkul Hizmetleri,(0216) 532 73 73,"Valide-i Atik, Nuhkuyusu Cd No:91/B, 34664 Üsküdar/İstanbul, Türkiye",http://www.yankigayrimenkul.com/,4.5,76
Güney İnşaat & Gayrimenkul,(0216) 415 87 73,"Bulgurlu Mahallesi Bulgurlu Caddesi, Bulgurlu, İskender Sk. No:7/A, 34000 Üsküdar/İstanbul, Türkiye",http://www.guneyinsaat.com/,4.8,30
Ofis Üsküdar İnşaat Mimarlık ve Gayrimenkul Danışmanlığı,0542 717 01 79,"Bulgurlu, Günaydın Sk. No:2/3, 34696 Üsküdar/İstanbul, Türkiye",http://www.ofisuskudar.com/,5,9
MERKEZ EMLAK GAYRİMENKUL,(0216) 532 32 40,"Mimar Sinan, Selam-ı Ali Efendi Cd. NO: 27 -1, 34672 Üsküdar/İstanbul, Türkiye",http://merkezemlak.sahibinden.com/,2.9,15
AYREAL GAYRİMENKUL,(0216) 412 84 25,"Cumhuriyet, Sultan Fatih Sk. No:3, 34699 Üsküdar/İstanbul, Türkiye",,5,12
Ermaks Gayrimenkul Proje Ofisleri,(0216) 651 98 14,"Güllübahçe sok. B/Blok 4/2A, Altunizade, 34662 Üsküdar/İstanbul, Türkiye",http://www.ermaks.com.tr/,5,18
Bosforce Emlak Geliştirme ve Pazarlama,444 9 254,"Çengelköy, Ulvi Sk. No:34, 34680 Üsküdar/İstanbul, Türkiye",http://www.bosforce.com.tr/,4.8,23
Yeşilyurt İnşaat ve Gayrimenkul,(0216) 321 99 09,"Beylerbeyi, Yalıboyu Cd. No: 45, 34674 Üsküdar/İstanbul, Türkiye",http://www.yesilyurtgayrimenkul.com/,5,23
Arya EmLak MüşavirLik,0532 205 59 42,"VaLide i Atik MahaLLesi, Zeynep Kamil, Miroğlu Sk. HiLaL Apt No 99B, 34664 Üsküdar/İstanbul, Türkiye",,5,9
Pınar gayrimenkul üsküdar,(0216) 310 33 54,"Zeynep Kamil, Dr. Fahri Atabey Cd. No:88, 34668 Üsküdar/İstanbul, Türkiye",,3.2,9
ASLAN GAYRİMENKUL,0539 565 79 96,"no:, Bahçelievler, Sultan Murat Cd. 29-9, 34688 Üsküdar/İstanbul, Türkiye",,4,19
Gold Gayrimenkul,(0216) 530 34 30,"Mahallesi, Aziz Mahmut Hüdayi, Doğancılar Cd. No:95/A, 34672 Üsküdar/İstanbul, Türkiye",http://www.goldgayrimenkul.com/,4.3,19
M & S Emlak,(0216) 495 34 64,"16, Aziz Mahmut Hüdayi, Halk Cd., 34672 Üsküdar/İstanbul, Türkiye",http://msemlakofisi.sahibinden.com/,4.7,16
Üçel Emlak - Çengelköy,(0216) 318 12 42,"Çengelköy, Kerime Hatun Cami Sk. No:8, 34680 Üsküdar/İstanbul, Türkiye",,4.9,13
Renk Gayrimenkul,,"Acıbadem, Acıbadem Cd. No:161/17, 34660 Üsküdar/İstanbul, Türkiye",,4.9,14
ALOT GAYRİMENKUL,(0216) 759 55 77,"Kirazlıtepe, Mehmet Akif Ersoy Cd. No:122/ B, 34682 Üsküdar/İstanbul, Türkiye",http://www.alotgayrimenkul.com.tr/,4.5,17
Erdem Emlak,0532 520 33 66,"Bulgurlu, Gürpınar Cd. No:2, 34696 Üsküdar/İstanbul, Türkiye",,4.5,63
