name,phone,address,website,rating,user_ratings_total
MURAT EMLAK,(0212) 626 60 65,"Akşemsettin, Cengiz Topel Cd. NO:78/B, 34070 Eyüpsultan/İstanbul, Türkiye",,5,1
Uzunlar Gayrimenkul,(0212) 322 34 49,"Göktürk Merkez, Göktürk Cd. No:3/D, 34077 Eyüpsultan/İstanbul, Türkiye",https://www.uzunlargayrimenkul.com/,5,4
Eyüpoğulları İnşaat & Emlak,(0212) 674 35 47,"Eyüpoğulları İş Hanı, Orta, Demirkapı Cd. D:23/12, 34030 Bayrampaşa/İstanbul, Türkiye",http://www.eyupogullari.com.tr/,4.9,109
Mars Global Gayrimenkul,0535 672 77 77,"Göktürk Merkez Mah Cami Sk. No:6 D:Kat:1 Daire:3, Göktürk Merkez, 34077 Eyüpsultan/İstanbul, Türkiye",http://www.marsglobalgayrimenkul.com.tr/,5,26
Emre Gayrimenkul,(0212) 427 57 57,"104, Çırçır, Saya Yolu Cd., 34070 Eyüpsultan/İstanbul, Türkiye",,5,1
Favori Emlak,(0212) 625 25 30,"Yeşilpınar, Çoşkun Sk. 13A, 34065 Eyüpsultan/İstanbul, Türkiye",,5,2
Turyap Alibeyköy Temsilciliği,(0212) 627 31 55,"Güzeltepe, Mareşal Fevzi Çakmak Cd. No:168, 34060 Eyüpsultan/İstanbul, Türkiye",http://www.turyap.com.tr/,3.6,8
Mimosa Gayrimenkul,(0212) 931 33 81,"Göktürk Merkez, İstanbul Cd., 34077 Eyüp/Eyüpsultan/İstanbul, Türkiye",https://mimosagayrimenkul.sahibinden.com/,5,1
Ömer Yıldırım - Gayrimenkul Danışmanı,0536 260 55 65,"Muratpaşa, Cumhuriyet Cd. No:155, 34035 Bayrampaşa/İstanbul, Türkiye",http://merhabaemlak.com.tr/,5,68
MERHABA EMLAK - Emlak Alım Satım Kiralama Hizmetleri,0532 219 24 27,"Muratpaşa, Cumhuriyet Cd. No:155 D:A, 34035 Bayrampaşa/İstanbul, Türkiye",http://merhabaemlak.com/,5,24
Es İnşaat Emlak,0530 230 11 05,"Kartaltepe, Ordu Cd. No:155, 34040 Bayrampaşa/İstanbul, Türkiye",,5,16
Balkan Emlak Gayrimenkul,(0212) 613 53 63,"Yenidoğan, Abdi İpekçi Cd. NO:55 KAT 3, 34030 Bayrampaşa/İstanbul, Türkiye",http://balkanemlakgayrimenkul.com/,5,21
Abdulkadir Altıok Gayrimenkul Danışmanı,0532 390 49 60,"Muratpaşa, Cumhuriyet Cd. 155/A, 34035 Bayrampaşa/İstanbul, Türkiye",https://www.merhabaemlak.com.tr/,5,28
Yuşa Evim Gayrimenkul,(0212) 565 05 61,"Muratpaşa, Tuna Cd. No:48, 34040 Bayrampaşa/İstanbul, Türkiye",http://www.yusaevim.com/,4.4,20
Bayrampaşa uluyol turyap,0543 615 13 13,"Muratpaşa, Büyük Coşkun Sk. No:4\B, 34040 Bayrampaşa/İstanbul, Türkiye",https://turyapuluyol.sahibinden.com/,5,15
Saydam Emlak,0544 565 48 88,"Kocatepe, 19. Sk. 51/A, 34045 Bayrampaşa/İstanbul, Türkiye",https://saydamemlak.sahibinden.com/,3.7,11
Serap Gayrimenkul Yorum İstanbul Şube,0537 932 27 27,"Kocatepe, Yorum Sk, 34045 Bayrampaşa/İstanbul, Türkiye",,4,12
Üçler Emlak,(0212) 577 45 45,"Yenidoğan, Numunebağı Cd. No ; 21, 34030 Bayrampaşa/İstanbul, Türkiye",https://www.hurriyetemlak.com/emlak-ofisi/ucler-emlak-109545,2.3,4
Yeşil İnşaat ve Gayrimenkul,0532 414 54 80,"Cevatpaşa, Turna Sokağı 4 A, 34045 Bayrampaşa/İstanbul, Türkiye",https://www.hepsiemlak.com/emlak-ofisi/yesil-insaat-33066,4.5,21
Turyap Bayrampaşa Çarşı Temsilciliği,(0212) 577 77 55,"Orta, Ceviz Sk. No:20A, 34230 Bayrampaşa/İstanbul, Türkiye",https://www.turyap.com.tr/bayrampasacarsi,5,1
Berçin Emlak,0532 660 93 97,"Kartaltepe, Ordu Cd. No:159, 34040 Bayrampaşa/İstanbul, Türkiye",https://bercingayrimenkul.sahibinden.com/,5,3
ORYAP EMLAK,(0212) 565 66 11,"Yenidoğan, Çakmak Sk. No:15, 34000 Bayrampaşa/İstanbul, Türkiye",,4.6,9
GÖRGÜLÜLER EMLAK&İNŞAAT,(0212) 476 03 68,"66, Yıldırım, Kınalıada Sokağı, 34045 Bayrampaşa/İstanbul, Türkiye",http://gorgululeremlak.sahibinden.com/,3.2,11
Şahiner Gayrimenkul,0552 363 17 27,"Muratpaşa, Ata Cd. No:18, 34040 Bayrampaşa/İstanbul, Türkiye",https://sahinergayrimenkul.com/,5,6
Tr,0534 405 11 89,"Kartaltepe, Ordu Cd. No:164 D:B, 34040 Bayrampaşa/İstanbul, Türkiye",https://carsiemlakgayrimenkul.sahibinden.com/,4.7,13
ŞenÇağ Gayrimenkul,0553 774 96 94,"ŞenÇağ Gayrimenkul, Altıntepsi, Atatürk Cd. No:68, 34035 Bayrampaşa/İstanbul, Türkiye",,5,8
GÖZDE GAYRİMENKUL,0532 453 91 18,"Cevatpaşa, Adem Yavuz Cd. No:1 D:3A, 34200 Bayrampaşa/İstanbul, Türkiye",http://gozdeinsaatemlak.sahibinden.com/,5,1
Çakiroğlu Gayrimenkul,(0212) 640 40 23,"Kartaltepe, Süleyman Şah Cd NO:41/C, 34040 Bayrampaşa/İstanbul, Türkiye",https://bayrampasacakirogluemlak.sahibinden.com/emlak?sorting=date_desc&display=list,4.2,6
PARS EMLAK BAYRAMPAŞA,0533 399 50 10,"Yıldırım, Avasköy Yolu Cd. No:36, 34045 Bayrampaşa/İstanbul, Türkiye",,5,12
AREA GAYRİMENKUL BAYRAMPAŞA,0535 295 07 27,"Muratpaşa Mahallesi, Tuna Caddesi, Muratpaşa, Hayır Sk., 34040 Bayrampaşa/İstanbul, Türkiye",http://istanbularea.com/,4,4
Bayrampaşa Turyap meydan,0543 482 19 19,"Yenidoğan, Burcu Sk. No:25, 34040 Bayrampaşa/İstanbul, Türkiye",,5,1
SEÇKİN EMLAK,(0212) 538 17 56,"Yıldırım, Zafer Cd. 92/B, 34045 Bayrampaşa/İstanbul, Türkiye",http://seckinemlakinsaat.com/,3.3,3
REMAX DENGE Gayrimenkul Danışmanlık,(0212) 501 95 01,"Topçular, Yenidoğan Mah. Rami Kışla Cad. Hekimoğlu Plaza, Yenidoğan, No:67 D:21, 34030 Bayrampaşa/İstanbul, Türkiye",http://www.remaxdenge.com/,4.4,49
Serkan Emlak,(0212) 565 15 93,"29/C ArdaTuran Caddesi, Altıntepsi, 34035 Bayrampaşa/İstanbul, Türkiye",,3.5,2
Üç-El Emlak Inşaat & Dekorasyon,(0212) 477 87 44,"Yıldırım, Zafer Cd. No:106, 34045 Bayrampaşa/İstanbul, Türkiye",,4.2,5
AKARCA GAYRİMENKUL VE OTOMOTİV,0532 605 33 01,"Terazidere, Esenler Cd. No:164/A:, 34035 Bayrampaşa/İstanbul, Türkiye",http://akarcaemlak.sahibinden.com/,5,5
ŞANSAL YAPI GAYRİMENKUL,0531 961 84 22,"Muratpaşa, Cumhuriyet Cd. 43a, 34045 Bayrampaşa/İstanbul, Türkiye",https://sansalyapigayrimenkul.sahibinden.com/,5,1
Yıldırım Emlak,(0212) 437 40 40,"Kocatepe, 36. Sk. No:8, 34045 Bayrampaşa/İstanbul, Türkiye",,5,1
Turyap,(0212) 544 44 07,"3, Yenidoğan, Abdi İpekçi Cd. No:55, 34040 Bayrampaşa/İstanbul, Türkiye",http://turyap.com.tr/,3.7,6
BALCIOĞLU GAYRİMENKUL DANIŞMANLIK İNŞAAT HİZMETLERİ,(0212) 564 48 34,"Muratpaşa, Cumhuriyet Cd. No : 81, 34040 Bayrampaşa/İstanbul, Türkiye",,4.3,7
REMAX / UĞUR ÖZBEK EMLAK DANIŞMANI BAYRAMPAŞA,0545 542 50 02,"Topçular, Yenidoğan, Rami Kışla Cad Hekimoğlu Plaza, 34030 Bayrampaşa/İstanbul, Türkiye",https://www.remax.com.tr/danisman/19621/ugur-ozbek,5,6
Elmas Grup İnşaat Gayrimenkul,(0212) 777 00 00,"Yıldırım, Millet Cd. 95/A, 34120 Bayrampaşa/İstanbul, Türkiye",,4.7,10
ERTÜRK GAYRİMENKUL & OTOMOTİV,0539 882 82 72,"Altıntepsi, Kutlu Sokaği No:52, 34035 Bayrampaşa/İstanbul, Türkiye",http://www.gayrimenkulerturk.com/,4.5,2
Karaosmanoğlu İnşaat,(0212) 567 80 00,"Altıntepsi, Malazgirt Sk. No:15/C, 34035 Bayrampaşa/İstanbul, Türkiye",https://karaosmanoglu.sahibinden.com/,4.9,7
Emin Emlak Gayrimenkul,,"Kartaltepe, Ürgüplü Cd. 55 A, 34040 Bayrampaşa/İstanbul, Türkiye",,5,2
Hedef Emlak,(0212) 640 92 61,"Kartaltepe, Cicoz Yolu Cd. No:132, 34040 Bayrampaşa/İstanbul, Türkiye",https://hedefemlkk.sahibinden.com/,4.3,6
REMAX DENGE AHMET SEZER,0533 590 30 30,"Topçular, HEKİMOĞLU PLAZA, Yenidoğan, Rami Kışla Cd. No:67 D:21 Kat:2, 34040 Bayrampaşa/İstanbul, Türkiye",https://www.remax.com.tr/danisman/8754/ahmet-sezer,5,34
Irmak Emlak,(0212) 616 55 28,"GÜN IŞIĞI KONUTLARI, İsmet Paşa, Kenar Sokağı O BLOK D:2, 34040 Bayrampaşa/İstanbul, Türkiye",,3.8,11
EVZADE GAYRİMENKUL,0532 172 18 88,"Yıldırım, Millet Cd. NO:89, 34170 Bayrampaşa/İstanbul, Türkiye",https://evzadegayrimenkul.sahibinden.com/,5,3
Bizim Emlak Otomotiv,(0212) 480 08 08,"Altıntepsi, İstiklal Cd., 34035 Bayrampaşa/İstanbul, Türkiye",,5,4
ERSOYLAR YAPI-EMLAK,0507 340 10 86,"Altıntepsi, Kondova Sok. 17/A, 34034 Bayrampaşa/İstanbul, Türkiye",,4.7,6
Murat Demirci - Re/max Marca Ticari Gayrimenkul Danışmanı,0505 470 08 90,"Yenidoğan, Abdi İpekçi Cd. No:74, 34040 Bayrampaşa/İstanbul, Türkiye",,5,3
Dekomim Gayrimenkul,(0212) 437 06 36,"Yıldırım, 19. Sk. No:20, 34045 Bayrampaşa/Istanbul - Europe, Türkiye",http://dekomimemlak.com/hakkimizda,3.6,11
Yiğit Gayrimenkul Emlak Danışmanlığı,(0212) 567 56 58,"İsmet Paşa, Fulya Sk. no:68 D:E, 34040 Bayrampaşa/İstanbul, Türkiye",,,
Şahin Gayrimenkul,0553 643 47 31,"Kartaltepe Cicoz Yolu Caddesi No:146 D:A, Kartaltepe, 34040 Bayrampaşa/İstanbul, Türkiye",,3.7,3
Gönüllü Yapi Gayrimenkul,(0212) 544 31 80,"Altıntepsi, Altıntepe Sokaği No:46, 34035 Bayrampaşa/İstanbul, Türkiye",,3.9,7
Kent Emlak,(0212) 501 71 72,"30, Altıntepsi, Arda Turan Cd., 34035 Bayrampaşa/İstanbul, Türkiye",,5,3
Asay Gayrimenkul Danışmanlık,(0212) 437 26 84,"Kocatepe, 19. Sk. No:81/A, 34045 Bayrampaşa/İstanbul, Türkiye",,5,1
Rekon Gayrimenkul Danişmanlik,,"İsmet Paşa, Tuna Cd. No:31, 34040 Bayrampaşa/İstanbul, Türkiye",,5,1
Serin Gayrimenkul,(0212) 542 23 11,"Muratpaşa, Demirhisar Cd. 36 A, 34040 Bayrampaşa/İstanbul, Türkiye",,4,3
Kaçmaz Emlak,(0212) 497 42 43,"Muratpaşa, Cumhuriyet Cd. 167/B, 34040 Bayrampaşa/İstanbul, Türkiye",http://www.kacmazemlak.com/,2.6,5
Mutlu Gayrimenkul Danişmanlik,0543 343 68 03,"Muratpaşa, Cumhuriyet Cd. No:83/A, 34040 Bayrampaşa/İstanbul, Türkiye",,,
Yiğit Emlak,(0212) 613 83 59,"Terazidere, Aydın Sk. 20 C, 34035 Bayrampaşa/İstanbul, Türkiye",https://yigitemlakbpasa.sahibinden.com/,3,2
turkuaz gayrimenkul,0552 438 70 10,"Yıldırım, Uludağ Sk. no 68/A, 34045 Bayrampaşa/İstanbul, Türkiye",,5,1
Hedef Gayrimenkul,,"Yıldırım, Millet Cd. 57B, 34045 Bayrampaşa/İstanbul, Türkiye",https://hedefgayrimenkull.sahibinden.com/,5,1
YAMANLAR GAYRİMENKUL BAYRAMPAŞA,0533 638 00 10,"Yıldırım, Nazar Sk. nazar apt no 7a, 34045 Bayrampaşa/İstanbul, Türkiye",http://www.yamanlargayrimenkulbayrampasa.com/,,
Mutlu Gayrimenkul,0532 502 02 70,"Yenidoğan, Abdi İpekçi Cd. 39/26, 34030 Bayrampaşa/İstanbul, Türkiye",,,
Esila Gayrimenkul ( Emlak ) Arnavutköy Satılık Arsa,0530 273 11 22,"Mahallesi, Arnavutköy Merkez, Fatih Cd. No:94, 34275 Arnavutköy/İstanbul, Türkiye",http://www.arnavutkoyemlak.net/,4.8,63
DEM GAYRİMENKUL ARNAVUTKÖY,(0212) 787 23 91,"Karlıbayır, Selçuklu Cd. No:3-C, 34275 Arnavutköy/İstanbul, Türkiye",https://demgayrimenkularnavutkoy.sahibinden.com/emlak?sorting=date_desc&display=list,5,51
Arnavutköy Emlak,0541 635 73 61,"Merkez Mahallesi, Fatih Cd. No:1245 D D:13, 34275 Arnavutköy/İstanbul, Türkiye",https://www.arnavutkoyemlakdanismanlik.com/,5,32
ÖZAY GAYRİMENKUL EMLAK DANIŞMANLIĞI ( Alım Satım Kiralama Ofisi),0554 705 45 50,"Arnavutköy Merkez, Fatih Cd. Erka İş Merkezi No:5 Kat:5 D:16, 34275 Arnavutköy/İstanbul, Türkiye",http://www.ozaygayrimenkul.com/,4.8,153
Arnavutköy Emlak NET,0536 579 82 03,"Merkez Mah, İnce Sk. No:4A, 34277 Arnavutköy/İstanbul, Türkiye",http://www.arsabul.org/,5,29
Karasu Emlak Arnavutköy,(0212) 429 38 45,"Arnavutköy Merkez, Cihaner Sk. No:4, 34275 Arnavutköy/İstanbul, Türkiye",http://www.karasuemlak34.com.tr/,4.9,11
KADIOĞLU EMLAK & İNŞAAT,(0212) 597 20 15,"Anadolu, Gaziosmanpaşa Cd. No:6/1, 34275 Arnavutköy/İstanbul, Türkiye",http://kadioglugrup.com/,4.9,46
Arnavutköy Emlak Acentesi ( Arnavutköyde Satılık Arsa ),(0212) 232 62 32,"Anadolu Mahallesi Eski Edirne Caddesi No:1310 K:1 D:7, Anadolu, 34275 Arnavutköy/İstanbul, Türkiye",http://www.emlakacentesi.com/,5,4
Yiğit Emlak & İnşaat,,"Adnan Menderes, Yahya Kemal Cd. NO:132, 34220 Arnavutköy/İstanbul, Türkiye",http://www.yigitemlakarnavutkoy.com/,4.9,41
YES İNVEST GAYRİMENKUL,0532 689 98 52,"mahallesinde, Mustafa Kemal Paşa, Kazım Karabekir Cd. No:189, 34281 Arnavutköy/İstanbul, Türkiye",http://www.yesinvestgayrimenkul.com/,5,105
Fırat Emlak İnşaat,(0212) 597 85 75,"Mustafa Kemal Paşa, Kazım Karabekir Cd. No: 109, 34250 Arnavutköy/İstanbul, Türkiye",https://www.firatemlak.com.tr/,5,70
Memişoğlu Emlak,0545 271 90 54,"Karlıbayır, Selçuklu Cd. No:27c, 34275 Arnavutköy/İstanbul, Türkiye",http://www.memisogluemlak.com/,4.7,27
Genç Gayrimenkul,(0212) 597 12 16,"Mustafa Kemal Paşa, Kazım Karabekir Cd. No:135/A, 34275 Arnavutköy/İstanbul, Türkiye",http://www.arnavutkoy.net/,4.8,10
ALTUNTAŞ GAYRİMENKUL,(0212) 597 99 32,"Mustafa Kemal Paşa, Fatih Cd. 167\D, 34000 Arnavutköy/İstanbul, Türkiye",,5,24
YAKUT GRUP GAYRİMENKUL,0531 523 98 11,"Arnavutköy Merkez, Karatay Sk. no:16 kat: no:5, 34275 Arnavutköy/İstanbul, Türkiye",,5,55
Coldwell Banker Metaş Gayrimenkul,(0212) 824 04 04,"İslambey, Fatih Cd. no:74, 34275 Arnavutköy/İstanbul, Türkiye",,4.5,22
TURYAP Arnavutköy Taşoluk Temsilciliği,(0212) 683 10 40,"No:1568, Karlıbayır, Eski Edirne Cd., 34281 Arnavutköy/İstanbul, Türkiye",,4.8,16
LİV YATIRIM,0531 217 86 49,"merkez mahallesi, eski edirne asfaltı caddesi no;1243, daire;3, 34275 Arnavutköy/İstanbul, Türkiye",http://www.livyatirim.com/,4.9,32
Ada Emlak Arnavutköy arsa alım satım hizmetleri,0542 153 52 52,"Karlıbayır, Selçuklu Cd. No:37 kat 1 d7, 34281 Arnavutköy/İstanbul, Türkiye",,5,13
Foma Emlak,0532 578 07 42,"5, Arnavutköy Merkez, Gaziosmanpaşa Cd., 34275 Arnavutköy/İstanbul, Türkiye",http://www.fomaemlak.com/,4.6,29
Müstakil Emlak Arsa Ofisi,0554 370 66 66,"Zümrüt İş Merkezi, Arnavutköy Merkez, Eski Edirne Asfaltı Caddesi No: 1243 Kat: 3 D: 7, 34000 Arnavutköy/İstanbul, Türkiye",https://www.mustakilemlak.com/,4.8,12
Tevekkül Emlak,0501 369 34 00,"Arnavutköy Merkez, Baykan Sk. No:24, 34275 Arnavutköy/İstanbul, Türkiye",,5,10
Yunus Emlak,(0212) 597 44 04,"Fatih Caddesi no:60 (Yapı Kredi Bankası Karşısı) İstanbul, İslambey, 34275 Arnavutköy/İstanbul, Türkiye",,5,1
Seyat Emlak Gayrimenkul,0536 995 77 13,"Arnavutköy Merkez, D:1, 34275 Arnavutköy/İstanbul, Türkiye",,5,25
Metropol istanbul gayrimenkul,0538 230 91 53,"Arnavutköy Merkez, Adaş Sk. no : 6 / d, 34275 Arnavutköy/İstanbul, Türkiye",http://www.istanbularsa.com.tr/,,
EVA GAYRİMENKUL Arnavutköy,0534 567 67 48,"Anadolu, Nurbanu Sk. No:12, 34275 Arnavutköy/İstanbul, Türkiye",,5,2
Ahi Gayrimenkul Arnavutköy,(0212) 597 86 50,"Mustafa Kemalpaşa Mah. Kazım Karabekir Cad Mucize Sk. No:1 Kat: 2 | Ofis: 5, Ahi Fırat İş Mrk, Mustafa Kemal Paşa, 34275 Arnavutköy/İstanbul, Türkiye",http://ahigayrimenkul.com.tr/,2.9,13
Sahibinden Satılık Arsa,0545 299 91 77,"Merkez mah. Berkay Sok. Gürses İş Merkezi 2/3, Arnavutköy Merkez, 34275 Arnavutköy/İstanbul, Türkiye",https://sahibindensatilikarsa.com.tr/,4.1,53
Remax REMAX Re/max Arnavutköy Çatalca Emlak Ticari Gayrimenkul Arsa Uzmanı Arnavutköy Çatalca Yusuf Aydemir Remax Marca,0532 232 35 25,"Karlıbayır, 34281 Arnavutköy/İstanbul, Türkiye",,5,77
AKTİF GAYRİMENKUL-ARNAVUTKÖY,(0212) 597 45 47,"Anadolu, Gaziosmanpaşa Cd. no 24 /a, 34100 Arnavutköy/İstanbul, Türkiye",,5,2
Ceyhan Gayrimenkul,0530 494 26 04,"merkez mahallesi, Osman Gazi Cd. no:10, 34275 Arnavutköy/İstanbul, Türkiye",https://ceyhangayrimenkul.sahibinden.com/,5,10
Arnavutköy Emlak,0532 220 49 28,"Gaziosmanpaşa Cd. No :8 D: 15, Arnavutköy Merkez, 34275 Arnavutköy/İstanbul, Türkiye",,,
AGT GAYRİMENKUL ARNAVUTKÖY,0539 596 89 79,"Anadolu, Yunus Emre Cd. no:14, 34158 Arnavutköy/İstanbul, Türkiye",https://agtgayrimenkul.sahibinden.com/,5,1
Gayrimenkul Danışmanı Ahmet EKMEKÇİ,0531 895 49 66,"Arnavutköy Belediyesi Karşısı, Karlıbayır, Selçuklu Cd. No:3, 34275 Arnavutköy/İstanbul, Türkiye",https://www.ahmetekmekci.com.tr/,5,27
ÇİFÇİ GAYRİMENKUL,0537 960 18 49,"Anadolu, Kader Sokak No: 5, 34275 Arnavutköy/İstanbul, Türkiye",,4.7,12
BİR YATIRIM - Arnavutköy,(0212) 597 44 10,"Merkez Mahallesi, Fatih Cd. No:16/1, 34275 Arnavutköy/İstanbul, Türkiye",,5,1
Talas Emlak,(0212) 597 73 95,"Merkez Mah, Eski Edirne Cd. No:1336/A, 34600 Arnavutköy/İstanbul, Türkiye",https://www.talasemlak.com/,5,12
Arnavutköy Emin Emlak,0532 155 30 57,"Arnavutköy Merkez, Karatay Sk. No:18, 34275 Arnavutköy/İstanbul, Türkiye",https://arnavutkoyeminemlak.sahibinden.com/,2.9,8
SETYAP GAYRİMENKUL,0533 471 41 05,"Arnavutköy Merkez, Şener Sk., 34275 Arnavutköy/İstanbul, Türkiye",,5,2
Delikaya Emlak Bolluca,(0212) 597 03 03,"Mavigöl, Koca Yusuf Cd. 41 1/1, 34287 Arnavutköy/İstanbul, Türkiye",,5,12
Arnavutkoy satılık arsa ofısı,0532 703 92 83,"Arnavutköy Merkez, Cihaner Sk. No:4, 34275 Arnavutköy/İstanbul, Türkiye",http://www.karasuemlak34.com.tr/,5,1
Sevin Gayrimenkul,(0212) 597 65 92,"Taşoluk, Kazım Karabekir Cd. No:99, 34275 Arnavutköy/İstanbul, Türkiye",http://www.sevinarsaofisi.com/,5,1
COLDWELL BANKER RAM,(0212) 597 50 20,"Karlıbayır, Selçuklu Cd. No:49/2, 34275 Arnavutköy/İstanbul, Türkiye",https://coldwellbankerram.sahibinden.com/,4.8,20
ZENGİN GAYRİMENKUL,0532 560 21 80,"Anadolu, Gaziosmanpaşa Cd. No: 18/A, 34275 Arnavutköy/İstanbul, Türkiye",,4,6
HAS M&G GAYRİMENKUL,0538 888 48 17,"Karlıbayır, Candoğan Sk. No:1 Kat 1, 34275 Arnavutköy/İstanbul, Türkiye",,4.6,10
FATİH EMLAK,0536 958 18 04,"Mustafa Kemal Paşa, Fatih Cd. No:117, 34275 Arnavutköy/İstanbul, Türkiye",,5,3
Arnavutköy Emlak Danışmanlığı,0531 773 56 56,"İmrahor, İstanbul Cd, 34100 Arnavutköy/İstanbul, Türkiye",http://www.arnavutkoyemlakdanismanligi.com/,3.4,5
Emlakyap No 212 Arnavutköy,0531 508 97 65,"Anadolu, Gaziosmanpaşa Cd. No:20 Kat:2, 34275 Arnavutköy/İstanbul, Türkiye",https://www.emlakyap.com/OfisDetay/emlakyap-istanbul-arnavutkoy/15985,5,3
BALTACI Gayrimenkul,0532 356 38 80,"Arnavutköy merkez ,eski edirne Cd no: 1342 k : 3 no : 37, Arnavutköy Merkez, 34275 Arnavutköy/İstanbul, Türkiye",,5,11
TEMO Emlak & Gayrimenkul,0530 146 49 75,"Arnavutköy Merkez, Eski Edirne Asfaltı Caddesi No:1430 D:13, 34275 Arnavutköy/İstanbul, Türkiye",,5,20
ÇalışkanGYO,0542 573 91 13,"Arnavutköy, Yıldırım Beyazıt Cd. Karaca Palace Sitesi No:1-3C, 34275 Arnavutköy/İstanbul, Türkiye",http://caliskangyo.com.tr/,5,11
Yasin Gayrimenkul,0532 481 61 02,"Arnavutköy, Yunus Emre, Muharrem Sk. no:6A, 34275 Arnavutköy/İstanbul, Türkiye",https://sites.google.com/view/yasingayrimenkul?usp=sharing,,
EMLAK Dünyası Danışmanlık,0532 151 84 28,"Mustafa Kemal Paşa Mah. Eski Edirne Asfaltı Cad. No: 1548D, KiPTAŞ Konutları Ticaret Merkezi, Mustafa Kemal Paşa, 34275 Arnavutköy/İstanbul, Türkiye",,3.8,4
ERPAY İNŞAAT,0531 682 51 30,"MERKEZ MAH NO:5/1B, Arnavutköy Merkez, Gaziosmanpaşa Cd., 34275 Arnavutköy/İstanbul, Türkiye",,4.5,57
BİRSÖZ EMLAK ARNAVUTKÖY,0538 867 44 68,"ADNAN MENDERES MAHALLESİ Gülbağlar caddesi, Adnan Menderes, Taşoluk no:4, 34277 Arnavutköy/İstanbul, Türkiye",,3.7,6
İstanbul İnşaat&Gayrimenkul,(0212) 741 21 34,"Taşoluk, Mustafa Kemal Cd. No:28, 34283, 34000 Arnavutköy/İstanbul, Türkiye",http://istanbularsaofisi.net/,5,2
Nur Emlak Arnavutköy,(0212) 890 38 70,"Karlıbayır, İhtişam Sk. No:1 D:3A, 34281 Arnavutköy/İstanbul, Türkiye",https://nuremlak.com.tr/,5,2
KOCABEYLER GAYRİMENKUL İNŞAAT,0532 731 93 62,"Arnavutköy Merkez, Karatay Sk. 16 5, 34275 Arnavutköy/İstanbul, Türkiye",,5,2
KIZILAY Gayrimenkul | Emlak Ofisi,0544 579 97 72,"Anadolu, Yıldırım Beyazıt Cd. No:24c, 34275 Arnavutköy/İstanbul, Türkiye",https://sites.google.com/view/kizilaygayrimenkul,5,8
ÖZEL EMLAK / EMİN ÖZEL / ARNAVUTKÖY,0532 650 86 19,"Arnavutköy Merkez, Karatay Sk. No :6, 34275 Arnavutköy/İstanbul, Türkiye",,5,2
SARIYER REAL ESTATE,0533 662 58 63,"Sarıyer Merkez, Yeni Mahalle Cd no:59/A, 34473 Sarıyer/İstanbul, Türkiye",http://sariyerrealestate.com/,5,40
ADL ZİRVE GAYRİMENKUL,(0212) 242 02 02,"Büyükdere, Çayırbaşı Cd. 134 a no:134, 34453 Sarıyer/İstanbul, Türkiye",https://adlzirvegayrimenkul.sahibinden.com/,5,31
KARAGÖZ GAYRİMENKUL,0532 452 80 04,"Kireçburnu, Haydar Aliyev Cd. No:68/1, 34457 Sarıyer/İstanbul, Türkiye",https://karagozemlak.com/,4.8,10
"Sarıyer Emlakçısı - Kiralık, Satılık, Daire, Villa",(0212) 299 21 90,"Ferahevler, Derekır Sk No:10/A, 34457 Sarıyer/İstanbul, Türkiye",https://sariyeremlakcisi.com/,5,9
EMLAK KÜPÜ YILDIRIM GAYRİMENKUL & DANIŞMANLIK,,"Maden, Kilyos Cd. No:154, 34450 Sarıyer/İstanbul, Türkiye",,5,23
TURYAP Yeniköy Erdem Emlak,0536 951 18 02,"Yeniköy, Nuri Paşa Cd. No: 71, 34464 Sarıyer/İstanbul, Türkiye",https://www.sariyeremlakcisi.com/,4.3,11
Easy Gayrimenkul,0532 449 03 26,"Maslak, Unnamed Road, 34485 Sarıyer/İstanbul, Türkiye",,4.9,32
Remax FLY Gayrimenkul Danışmanlık / Sarıyer-Tarabya,(0212) 262 80 68,"Tarabya Mahallesi, Şalcıkır Caddesi, Tarabya, Şakacı Sk. No: 2/2, 34457 Sarıyer/İstanbul, Türkiye",https://remaxfly.com/,5,37
Uğur Soydan Emlak Borsası,0532 314 62 90,"arabayolu caddesi no 142 köşkevler, Kireçburnu, 34457 Sarıyer/İstanbul, Türkiye",http://ugursoydan.sahibinden.com/,4.4,12
Doğuş Emlak YENİKÖY - SARIYER - İSTANBUL,(0212) 299 78 58,"Yeniköy, Kapalı Bakkal Sk. 11/A, 34464 Sarıyer/İstanbul, Türkiye",,3.7,3
Murat Çakmak Gayrimenkul Danışmanlığı,(0212) 262 61 11,"Yeniköy, Adnan Kahveci Cd. No:114/B, 34440 Sarıyer/İstanbul, Türkiye",http://www.muratçakmak.com.tr/,5,3
PROFESYONEL REALTORS (Emlakçılar),0541 978 31 80,"Yeniköy, Sait Halim Paşa Cd., 34450 Sarıyer/İstanbul, Türkiye",http://www.proemlakcilar.sahibinden.com/,5,8
Plus Gayrimenkul,(0212) 286 47 47,"Maslak Mah. Taşyoncası Sok. Ağaoğlu 1453 Sitesi T4a Blok Kat -9, Maslak, 34398 Sarıyer/İstanbul, Türkiye",,5,178
Sarıyer Emlak Danışmanlığı,(0212) 218 47 47,"Sarıyer Merkez, Kekik Sk. No: 7/2, 34450 Sarıyer/İstanbul, Türkiye",http://sariyeremlaksariyer.com/,,
SARIYER TURYAP,0532 454 29 29,"Sarıyer Merkez, Meserburnu Cd. No:22-1, 34450 Sarıyer/İstanbul, Türkiye",,4.5,8
Sevince Demir Gayrimenkul,0532 256 79 44,"Zekeriyaköy Mah. Demir Celik Sokak Panora Life Sitesi 4 C Blok Dukkan 5, Koç Üniversitesi Batı Kampüsü Yanı, Zekeriyaköy, 34450 Sarıyer/İstanbul, Türkiye",http://sevincedemir.com/,5,11
Remax Sarıyer Emlak Danışmanı,0532 449 60 88,"İstinye, Mehter Sk. No:11, 34460 Sarıyer/İstanbul, Türkiye",,5,7
Etki Emlak,(0212) 223 62 24,"Tarabya, Şalcıkır Cd. 21/A, 34457 Sarıyer/İstanbul, Türkiye",http://www.etkiemlak.com/,5,8
REMAX SARIYER EMLAK DANIŞMANI MUHAMMET ALİ MERAL,0535 050 34 53,"İstinye, Çayır Mh. Sk. no:22 K:2, 34396 Sarıyer/İstanbul, Türkiye",https://www.remax.com.tr/danisman/39910/muhammet-ali-meral,5,11
Topaloğlu Emlak,(0212) 299 85 92,"Ferahevler, Balabandere Cd. No:54 B, 34457 Sarıyer/İstanbul, Türkiye",,4.3,12
Büyükdere Emlak,0507 835 99 63,"Büyükdere, Uzun Fıstık Sk. No:4A, 34453 Sarıyer/İstanbul, Türkiye",http://buyukdereemlak.net/,3.7,19
Mavi Beyaz Gayrimenkul,,"Tarabya, Han Çayırı Yolu Sk., 34457 Sarıyer/İstanbul, Türkiye",https://mavibeyazemlak.sahibinden.com/,5,6
YENİKÖY VIP GAYRİMENKUL,(0212) 223 33 53,"Ferahevler, Adnan Kahveci Cd. 37 C, 34457 Sarıyer/İstanbul, Türkiye",http://www.yenikoyvipgayrimenkul.com/,4.7,6
Keller Williams Karma Sarıyer Bölge Müdürlüğü,(0212) 229 18 88,"Poligon Mahallesi, Sarıyer Cd. ABC Plaza No:117/B, Kat: 2 D:5, Poligon, 34460 Sarıyer/İstanbul, Türkiye",,4.5,16
modest can emlak,0553 395 18 30,"Ferahevler Mah. Adnan Kahveci Cad. Avşar Sok. NO:2/B Sarıyer, Ferahevler, 34457 Sarıyer/İstanbul, Türkiye",,4.6,5
DB GAYRİMENKUL,0533 360 30 04,"maslak mah. mashattan sitesi anka sokak t-105 nolu ofis maslak mah. mashattan sitesi, t-105 nolu ofis, Maslak, Anka Sk., 34203 Sarıyer/İstanbul, Türkiye",,4.6,5
Hisar Emlak,(0212) 265 89 59,"Rumelihisarı, Rumeli Hisarı, Nisbetiye Cd No:61 D:C, 34470 Sarıyer/İstanbul, Türkiye",,1.6,13
Özgür Çoban Mashattan Yetkili Emlak Ofisi,0533 656 35 55,"Maslak Mah Anka Sok. Mashattan Ticari Kısım, Maslak, No: 113/114, 34398 Sarıyer/İstanbul, Türkiye",http://www.mashattan.net/,4.9,29
REMAX ASTYLE GAYRİMENKUL DANIŞMANLIK A.Ş.,0532 200 25 30,"HUZUR MAH. AZERBAYCAN CAD. SKYLAND SİTESİ B BLOK NO: 4B, İÇ KAPI, Huzur, NO: 80, 34475 Sarıyer/İstanbul, Türkiye",http://www.remaxastyle.com/,5,57
Dap Yeni Levent,444 9 327,"Huzur Mah. Cesur Sk, Huzur, İbrahim Karaoğlanoğlu Cd. Eski Polis Lojmanları, 34475 Sarıyer/İstanbul, Türkiye",http://yenilevent.com.tr/,3.9,218
Coldwell Banker Türkiye,(0212) 488 00 00,"Polaris Plaza Ahi Evran Cad. No:21 Kat:22, Maslak, 34398 Sarıyer/İstanbul, Türkiye",http://www.cb.com.tr/,4.5,83
Faik Yılmaz Gayrimenkul A.Ş.,0850 532 4225,"Seba Office Boulevard, Ayazağa, 34325 Sarıyer/İstanbul, Türkiye",https://www.faikyilmaz.com.tr/,4.6,7
Diamond Proje Gayrimenkul,(0212) 288 69 88,"Maden, Şifa Yolu Üstü Sk. 3/1, 34450 Sarıyer/İstanbul, Türkiye",http://www.diamondproje.com/,3.7,7
Rall & Sandıkçı,(0212) 342 01 00,"Yeniköy, Çelebi Deresi Sk. NO:16B, 34450 Sarıyer/İstanbul, Türkiye",http://www.rsgayrimenkul.com/,4.6,11
TURYAP SARIYER MADEN TEMSİLCİLİĞİ,(0212) 342 41 00,"kilyos caddesi no:171 Ruşenoğlu apt kat:1 Daire:3, Maden, 34450 Sarıyer/İstanbul, Türkiye",http://www.turyap.com.tr/sariyermaden,4.9,8
KD Gayrimenkul,0532 603 67 74,"Maslak, Akasya Sk. Ağaoğlu Maslak 1453 Residence 20/AE, 34485 Sarıyer/İstanbul, Türkiye",http://www.kdgayrimenkul.com/,4.7,3
GM GAYRİMENKUL VE MİMARLIK,0532 054 72 93,"Ayazağa, Mustafa Kemal Atatürk Cd No:12, 34475 Sarıyer/İstanbul, Türkiye",,5,3
Dinamik Gayrimenkul,0532 352 00 55,"Maslak, Maslak Meydan Sk. Beybi Giz Plaza No:1/15, 34398 Sarıyer/İstanbul, Türkiye",,5,1
FSOON GAYRİMENKUL AJANSI,0505 488 15 18,"Spring Giz Plaza, FSOON GAYRİMENKUL AJANSI, Maslak, Maslak Meydan Sk. No:5/6, 34485 Sarıyer/İstanbul, Türkiye",http://www.fsoon.com.tr/,5,16
Holl Gayrimenkul,(0212) 323 02 20,"Poligon Mah. Sarıyer Cd. No:117/B ABC Plaza Kat:2 D:5 Plaza Kat:2 D:5, Poligon, 34467 Sarıyer/İstanbul, Türkiye",,5,1
Aslan Gayrimenkul Mühendislik,0535 692 79 17,"İstinye, Çayır Cd. No:41, 34460 Sarıyer/İstanbul, Türkiye",,,
Alican Al Gayrimenkul,0507 403 30 38,"26, İstinye, İstinye Cd., 34460 Sarıyer/İstanbul, Türkiye",,5,1
